UPC	length	RECEIPT ALIAS	ITEM NAME	BRAND	SIZE	COST	SUID	VENDOR	UOM	PACK
852282002001	y	CLOS ERASMUS LAUREL 2015 DI	CLOS ERASMUS LAUREL 2015 DI	EC-EUROPEAN CELLARS/ERIC SOLOMON	750 ML	40	12089005	PINNACLE IMPORTS	CS	6
852282002070	y	LAMADRID CAB SAUV RESERVE 2013	LAMADRID CABERNET SAUVIGNON RESERVE 2013	VINO DEL SOL	750 ML	16.5	10913012	PINNACLE IMPORTS	CS	12
852282002148	y	ZOLO CAB 2015	ZOLO CAB 2015	VINO DEL SOL	750 ML	12	109700	PINNACLE IMPORTS	CS	12
852282002155	y	ZOLO CHARD 2015	ZOLO CHARD 2015	VINO DEL SOL	750 ML	12	109741	PINNACLE IMPORTS	CS	12
852282002155	y	COS CERASUOLO DI VITTORIA 2014	COS CERASUOLO DI VITTORIA 2014	DOMAINE SELECT WINE ESTATE	750 ML	30.25	120080	PINNACLE IMPORTS	CS	12
852282002162	35 NOOOOOOOO	COS CERASUOLO DI VITTORIA 2012 1.5L	COS CERASUOLO DI VITTORIA 2012 1.5L	DOMAINE SELECT WINE ESTATE	1.5 L	60.5	120083	PINNACLE IMPORTS	CS	4
852282002162	y	ZOLO MALBEC 2017	ZOLO MALBEC 2017	VINO DEL SOL	750 ML	12	109760	PINNACLE IMPORTS	CS	12
852282002209	y	ZOLO CAB RESERVE 2013	ZOLO CAB RESERVE 2013	VINO DEL SOL	750 ML	18	10972011	PINNACLE IMPORTS	CS	6
852282002209	y	ZOLO MALBEC RESERVE 2013	ZOLO MALBEC RESERVE 2013	VINO DEL SOL	750 ML	18	109721	PINNACLE IMPORTS	CS	6
852282002285	y	LAMADRID CAB SAUV 2013	LAMADRID CABERNET SAUVIGNON 2013	VINO DEL SOL	750 ML	14.25	10912013	PINNACLE IMPORTS	CS	12
852282002315	y	LAMADRID TORRONTES 2011 12750	LAMADRID TORRONTES 2011 12/750	VINO DEL SOL	750 ML	12.75	109180	PINNACLE IMPORTS	CS	12
852282002322	38 NOOOOOOOO	TAPIZ SELECCION DE BARRICAS BLEND 2012	TAPIZ SELECCION DE BARRICAS BLEND 2012	VINO DEL SOL	750 ML	25.5	109421	PINNACLE IMPORTS	CS	6
852282002322	48 NOOOOOOOO	CONTERNO FANTINO GINESTRINO LANGHE NEBBIOLO 2014	CONTERNO FANTINO GINESTRINO LANGHE NEBBIOLO 2014	EMPSON USA INC	750 ML	29.25	119130	PINNACLE IMPORTS	CS	12
852282002384	y	CLOS ERASMUS 2013 MAG DI	CLOS ERASMUS 2013 MAG DI	EC-EUROPEAN CELLARS/ERIC SOLOMON	1.5 L	325	120890	PINNACLE IMPORTS	EA	1
852282002384	y	CLOS ERASMUS 2014	CLOS ERASMUS 2014	EC-EUROPEAN CELLARS/ERIC SOLOMON	750 ML	139	12089006	PINNACLE IMPORTS	CS	3
852282002384	y	ALTOCEDRO CAB 2013	ALTOCEDRO CAB 2013	VINO DEL SOL	750 ML	15.75	108801	PINNACLE IMPORTS	CS	12
852282002384	y	ALTOCEDRO MALBEC 2013	ALTOCEDRO MALBEC 2013	VINO DEL SOL	750 ML	15.75	108800	PINNACLE IMPORTS	CS	12
852282002407	y	CLOS ERASMUS LAUREL 2013 MAG DI	CLOS ERASMUS LAUREL 2013 MAG DI	EC-EUROPEAN CELLARS/ERIC SOLOMON	1.5 L	87	120891	PINNACLE IMPORTS	CS	2
852282002438	y	TAPIZ BLK TEARS MALBEC 2012	TAPIZ BLK TEARS MALBEC 2012	VINO DEL SOL	750 ML	44.25	10942009	PINNACLE IMPORTS	CS	6
852282002513	y	TAPIZ ALTA CHRDNY 2013	TAPIZ ALTA CHRDNY 2013	VINO DEL SOL	750 ML	15.75	10940013	PINNACLE IMPORTS	CS	12
852282002544	36 NOOOOOOOO	MANOTSURU BULZAI GINJO SAKE 12300 ML	MANOTSURU BULZAI GINJO SAKE 12/300 ML	VINO DEL SOL	300 ML	12	107590	PINNACLE IMPORTS	CS	12
852282002544	y	CH. PLINCE POMEROL 2012	CH. PLINCE POMEROL 2012	DREYFUS - ASHBY	750 ML	49	11391012	PINNACLE IMPORTS	CS	12
852282002674	y	LAGAR AMALGAMA RD BLEND 2013	LAGAR AMALGAMA RD BLEND 2013	VINO DEL SOL	750 ML	10.5	124280	PINNACLE IMPORTS	CS	12
852282002704	y	ZOLO TORRONTES 2013	ZOLO TORRONTES 2013	VINO DEL SOL	750 ML	12	109791	PINNACLE IMPORTS	CS	12
852282002728	36 NOOOOOOOO	CONTERNO FANTINO MONPRA 2012 PRESELL	CONTERNO FANTINO MONPRA 2012 6PK PRESELL	EMPSON USA INC	750 ML		10670012	PINNACLE IMPORTS	CS	6
852282002728	y	TAPIZ TORRONTES 2011	TAPIZ TORRONTES 2011	VINO DEL SOL	750 ML	12.75	109470	PINNACLE IMPORTS	CS	12
852282002735	35 NOOOOOOOO	CLOS PISSARRA ARISTAN MONTSANT 2012	CLOS PISSARRA ARISTAN MONTSANT 2012	MIURA VINEYARDS	750 ML	17.25	11067109	PINNACLE IMPORTS	CS	12
852282002780	y	LAMADRID CAB FRANC 2014	LAMADRID CAB FRANC 2014	VINO DEL SOL	750 ML	16.5	115390	PINNACLE IMPORTS	CS	12
852282002803	y	GEN 5 CAB SAUV 2013	GEN 5 CABERNET SAUVIGNON 2013	VINO DEL SOL	750 ML	10.5	101510	PINNACLE IMPORTS	CS	12
852282002810	y	GEN 5 CHRDNY 2014	GEN 5 CHRDNY 2014	VINO DEL SOL	750 ML	10.5	101520	PINNACLE IMPORTS	CS	12
852282002896	y	TEHO MALBEC 2013 6750	TEHO MALBEC 2013 6/750	VINO DEL SOL	750 ML	61.5	109570	PINNACLE IMPORTS	CS	6
852282002902	34 NOOOOOOOO	ZAHA EL CORTE RD BLEND 2014 COSTCO	ZAHA EL CORTE RD BLEND 2014 COSTCO	VINO DEL SOL	750 ML	33.53	109561	PINNACLE IMPORTS	CS	6
852282002902	y	ZAHA MALBEC 2013 6750	ZAHA MALBEC 2013 6/750	VINO DEL SOL	750 ML	36	109560	PINNACLE IMPORTS	CS	6
852282002940	y	AALTO RIBERA DEL DUERO 2015 DI	AALTO RIBERA DEL DUERO 2015 DI	EC-EUROPEAN CELLARS/ERIC SOLOMON	750 ML	38.75	12085013	PINNACLE IMPORTS	CS	12
852282002971	36 NOOOOOOOO	MEYER CELLARS SPITFIRE CAB SAUV 2014	MEYER CELLARS SPITFIRE CABERNET SAUVIGNON 2014	MEYER CELLARS	750 ML	42	10226013	PINNACLE IMPORTS	CS	12
852282062292	y	LAMADRID MALBEC 2014	LAMADRID MALBEC 2014	VINO DEL SOL	750 ML	14.25	10915013	PINNACLE IMPORTS	CS	12
852285002070	33 NOOOOOOOO	FIFTY FIFTY ECLIPSE HIGH WEST RYE	FIFTY FIFTY ECLIPSE HIGH WEST RYE	TRUCKEE CRAFT BREWING	22 OZ		123090	PINNACLE IMPORTS	CS	12
852285002070	y	LAMADRID CAB SAUV RESERVE 2009	LAMADRID CABERNET SAUVIGNON RESERVE 2009	VINO DEL SOL	750 ML	16.5	115400	PINNACLE IMPORTS	CS	12
852285002070	36 NOOOOOOOO	LAMADRID CAB SAUV RESERVE 2010 12750	LAMADRID CABERNET SAUVIGNON RESERVE 2010 12/750	VINO DEL SOL	750 ML	16.5	109130	PINNACLE IMPORTS	CS	12
853466003036	y	SOTER NORTH VALLEY ROSE 2016	SOTER NORTH VALLEY ROSE 2016	SOTER VINEYARDS	750 ML	18.75	120312	PINNACLE IMPORTS	CS	12
853466003043	y	SOTER PLANET OREGON PN NOIR 2016	SOTER PLANET OREGON PINOT NOIR 2016	SOTER VINEYARDS	750 ML	18	10505012	PINNACLE IMPORTS	CS	12
853466003050	y	BUNNY SPARKLING SAKE	BUNNY SPARKLING SAKE	DOMAINE SELECT WINE ESTATE	300 ML	10.5	126730	PINNACLE IMPORTS	CS	12
853466003050	y	SOTER NORTH VALLEY CHRDNY 2013	SOTER NORTH VALLEY CHRDNY 2013	SOTER VINEYARDS	750 ML	25.5	12031113	PINNACLE IMPORTS	CS	12
853466003166	y	SOTER PLANET OREGON CHRDNY 2015	SOTER PLANET OREGON CHRDNY 2015	SOTER VINEYARDS	750 ML	16.5	1419	PINNACLE IMPORTS	CS	12
855979004098	33 NOOOOOOOO	CDR CRK LAWNRANGER CREAM ALE CANS	CEDAR CREEK LAWNRANGER CREAM ALE CANS	CEDAR CREEK BREWERY	12 OZ		126452	PINNACLE IMPORTS	CS	24
856036001005	y	UNDERWOOD CELLARS PN NOIR 2016	UNDERWOOD CELLARS PINOT NOIR 2016	UNION WINE COMPANY	750 ML	10.5	115300	PINNACLE IMPORTS	CS	12
856036001036	33 NOOOOOOOO	UNDERWOOD CELLARS PINOT GRIS 2016	UNDERWOOD CELLARS PINOT GRIS 2016	UNION WINE COMPANY	750 ML	10.5	115306	PINNACLE IMPORTS	CS	12
856036001043	39 NOOOOOOOO	UNDERWOOD CELLARS PN NOIR CANS  24375ML	UNDERWOOD CELLARS PINOT NOIR CANS / 24/375ML	UNION WINE COMPANY	375 ML	5.25	115302	PINNACLE IMPORTS	CS	24
856036001050	y	KINGS RIDGE PN NOIR 2016	KINGS RIDGE PINOT NOIR 2016	UNION WINE COMPANY	750 ML	15.75	104850	PINNACLE IMPORTS	CS	12
856036001067	42 NOOOOOOOO	UNDERWOOD CELLARS PINOT GRIS CANS  24375ML	UNDERWOOD CELLARS PINOT GRIS CANS / 24/375ML	UNION WINE COMPANY	375 ML	5.25	115301	PINNACLE IMPORTS	CS	24
856036001074	36 NOOOOOOOO	UNDERWOOD CELLARS ROSE CANS  24375ML	UNDERWOOD CELLARS ROSE CANS / 24/375ML	UNION WINE COMPANY	375 ML	5.25	115303	PINNACLE IMPORTS	CS	24
856036001098	39 NOOOOOOOO	UNDERWOOD CELLARS BUBBLES CANS  24375ML	UNDERWOOD CELLARS BUBBLES CANS / 24/375ML	UNION WINE COMPANY	375 ML	5.25	1543	PINNACLE IMPORTS	CS	24
856036001111	y	KINGS RIDGE PINOT GRIS 2016	KINGS RIDGE PINOT GRIS 2016	UNION WINE COMPANY	750 ML	12	104840	PINNACLE IMPORTS	CS	12
856036001128	y	KINGS RIDGE RIESLING 2014	KINGS RIDGE RIESLING 2014	UNION WINE COMPANY	750 ML	12	104841	PINNACLE IMPORTS	CS	12
856036001203	y	UNDERWOOD REISLING RADLER CANS	UNDERWOOD REISLING RADLER CANS	UNION WINE COMPANY	355 ML	5.25	1843	PINNACLE IMPORTS	CS	24
856036061081	y	UNDERWOOD CELLARS ROSE 2016	UNDERWOOD CELLARS ROSE 2016	UNION WINE COMPANY	750 ML	10.5	115305	PINNACLE IMPORTS	CS	12
856095000018	y	MINER NAPA VALLEY CHRDNY 2014	MINER NAPA VALLEY CHRDNY 2014	MINER FAMILY VINEYARDS	750 ML	26.25	10234012	PINNACLE IMPORTS	CS	12
856095000049	40 NOOOOOOOO	MINER FAMILY GARYS VINEYARD PN NOIR 2014	MINER FAMILY GARYS VINEYARD PINOT NOIR 2014 6PK	MINER FAMILY VINEYARDS	750 ML	48.75	10237012	PINNACLE IMPORTS	CS	6
856095000094	y	MINER SANGIOVESE 2015	MINER SANGIOVESE 2015	MINER FAMILY VINEYARDS	750 ML	23.25	10238013	PINNACLE IMPORTS	CS	12
856095000148	35 NOOOOOOOO	MINER ORACLE PROPRIETARY BLEND 2012	MINER ORACLE PROPRIETARY BLEND 2012	MINER FAMILY VINEYARDS	750 ML	71.25	10235010	PINNACLE IMPORTS	CS	6
856095000292	39 NOOOOOOOO	MINER NAPA CAB SAUV 2013 (EMILYS CUVEE)	MINER NAPA CABERNET SAUVIGNON 2013 (EMILYS CUVEE)	MINER FAMILY VINEYARDS	750 ML	40.5	10236113	PINNACLE IMPORTS	CS	12
856095000322	y	HERETIC CHOC HAZELNUT PORTER KEG	HERETIC CHOCOLATE HAZELNUT PORTER KEG	HERETIC BREWING CO.	5.16667GA L		126634	PINNACLE IMPORTS	EA	1
856095000322	37 NOOOOOOOO	MINER FAMILY CALIFORNIA VIOGNIER 2016	MINER FAMILY CALIFORNIA VIOGNIER 2016	MINER FAMILY VINEYARDS	750 ML	16.5	118380	PINNACLE IMPORTS	CS	12
856374001224	43 NOOOOOOOO	LA FOLLETTE SANGIACOMO VINEYARD CHRDNY 2012	LA FOLLETTE SANGIACOMO VINEYARD CHRDNY 2012	WINE CREEK CELLARS	750 ML	30	122700	PINNACLE IMPORTS	CS	12
856374001248	y	LAFOLLETTE CHARD 2014	LAFOLLETTE CHARD 2014	WINE CREEK CELLARS	750 ML	17.25	116040	PINNACLE IMPORTS	CS	12
856374001422	y	OCTOBERFEST 12 BBL KEG	THOMAS CREEK OCTOBERFEST 1/2 BBL KEG	THOMAS CREEK BREWERY	1/2 BB L		304400	PINNACLE IMPORTS	EA	1
856374001422	35 NOOOOOOOO	LA FOLLETTE SANGIACOMO PN NOIR 2012	LA FOLLETTE SANGIACOMO PINOT NOIR 2012	WINE CREEK CELLARS	750 ML	32.25	10184012	PINNACLE IMPORTS	CS	12
856374001446	37 NOOOOOOOO	BEAUX FRERES WILLIAMETTE PN NOIR 2013	BEAUX FRERES WILLIAMETTE PINOT NOIR 2013 6PK	HENRIOT-BEAUX FRERES	750 ML	48	11635013	PINNACLE IMPORTS	CS	6
856374001446	37 NOOOOOOOO	LA FOLLETTE VAN DER KAMP PN NOIR 2014	LA FOLLETTE VAN DER KAMP PINOT NOIR 2014	WINE CREEK CELLARS	750 ML	32.25	116051	PINNACLE IMPORTS	CS	12
856374001460	36 NOOOOOOOO	LA FOLLETTE NORTH COAST PN NOIR 2014	LA FOLLETTE NORTH COAST PINOT NOIR 2014	WINE CREEK CELLARS	750 ML	17.25	101860	PINNACLE IMPORTS	CS	12
856649002000	48 NOOOOOOOO	SHEA WINE CELLARS ESTATE WILLAMETTE PN NOIR 2013	SHEA WINE CELLARS ESTATE WILLAMETTE PINOT NOIR 2013	SHEA WINE CELLARS	750 ML	34.5	105002	PINNACLE IMPORTS	CS	12
856649002017	47 NOOOOOOOO	SHEA WINE CELLARS ESTATE WILLAMETTE CHRDNY 2012	SHEA WINE CELLARS ESTATE WILLAMETTE CHRDNY 2012	SHEA WINE CELLARS	750 ML	27	105001	PINNACLE IMPORTS	CS	12
857129003142	38 NOOOOOOOO	HERETIC TARTUFFE BERLINER WEISS BOMBER	HERETIC TARTUFFE BERLINER WEISS BOMBER	HERETIC BREWING CO.	22 OZ		126661	PINNACLE IMPORTS	CS	12
857129003203	35 NOOOOOOOO	HERETIC CHOC HAZELNUT PORTER BOMBER	HERETIC CHOCOLATE HAZELNUT PORTER BOMBER	HERETIC BREWING CO.	22 OZ		126660	PINNACLE IMPORTS	CS	12
857129003241	y	HERETIC PETIT ROUGE BOMBER	HERETIC PETIT ROUGE BOMBER	HERETIC BREWING CO.	22 OZ		126650	PINNACLE IMPORTS	CS	12
857129003357	y	HERETIC EVIL TWIN RD IPA CANS	HERETIC EVIL TWIN RD IPA CANS	HERETIC BREWING CO.	12 OZ		126640	PINNACLE IMPORTS	CS	24
857129003418	y	HERETIC EVIL COUSIN DIPA CANS	HERETIC EVIL COUSIN DIPA CANS	HERETIC BREWING CO.	12 OZ		126630	PINNACLE IMPORTS	CS	24
858497005080	y	CRIOS ROSE 2017	CRIOS ROSE 2017	FOLIO WINE COMPANY LLC	750 ML	11.25	108910	PINNACLE IMPORTS	CS	12
858902004202	y	HYLAND ESTATES RIESLING 2015	HYLAND ESTATES RIESLING 2015	HYLAND ESTATES	750 ML	15.75	125870	PINNACLE IMPORTS	CS	12
858902004219	34 NOOOOOOOO	HYLAND ESTATES GEWURZTRAMINER 2015	HYLAND ESTATES GEWURZTRAMINER 2015	HYLAND ESTATES	750 ML	15.75	125871	PINNACLE IMPORTS	CS	12
858902004226	34 NOOOOOOOO	HYLAND ESTATES PN NOIR ESTATE 2015	HYLAND ESTATES PINOT NOIR ESTATE 2015	HYLAND ESTATES	750 ML	24.75	125872	PINNACLE IMPORTS	CS	12
859141000369	35 NOOOOOOOO	BRAMARE CAB SAUV LUJAN DE CUYO 2015	BRAMARE CABERNET SAUVIGNON LUJAN DE CUYO 2015	PAUL HOBBS IMPORTS	750 ML	33.75	11543011	PINNACLE IMPORTS	CS	12
859481003013	y	LAMADRID MALBEC MATILDE 2008	LAMADRID MALBEC MATILDE 2008	VINO DEL SOL	750 ML	55	109161	PINNACLE IMPORTS	CS	6
859481003013	y	BLK CABRA CAB 2015	BLK CABRA CAB 2015	VINO DEL SOL	750 ML	10.5	109681	PINNACLE IMPORTS	CS	12
859481003020	y	BLK CABRA CHARD 2016	BLK CABRA CHARD 2016	VINO DEL SOL	750 ML	10.5	10967013	PINNACLE IMPORTS	CS	12
859481003068	y	T-VINE NAPA VALLEY GRENACHE 2011	T-VINE NAPA VALLEY GRENACHE 2011	T-VINE	750 ML	28.5	118801	PINNACLE IMPORTS	CS	12
859481003068	y	CLOS DES PAPES CDP 2013	CLOS DES PAPES CDP 2013	WINES OF FRANCE	750 ML	87.5	121761	PINNACLE IMPORTS	CS	12
859481003068	y	CLOS DES PAPES CDP BLANC 2016	CLOS DES PAPES CDP BLANC 2016	WINES OF FRANCE	750 ML	65.25	121770	PINNACLE IMPORTS	CS	12
859481003082	y	T-VINE NAPA VALLEY GRENACHE 2013	T-VINE NAPA VALLEY GRENACHE 2013	T-VINE	750 ML	28.5	11880113	PINNACLE IMPORTS	CS	12
859481003082	y	ANKO TORRONTES 2012	ANKO TORRONTES 2012	VINO DEL SOL	750 ML	12.75	108780	PINNACLE IMPORTS	CS	12
859481003082	y	ANKO TORRONTES 2013	ANKO TORRONTES 2013	VINO DEL SOL	750 ML	9.75	10878013	PINNACLE IMPORTS	CS	12
859481003082	44 NOOOOOOOO	CLOS DU MONT-OLIVET CDR FONT DE BLANCHE 2011	CLOS DU MONT-OLIVET CDR FONT DE BLANCHE 2011	NORTH BERKELEY IMPORTS	750 ML	15.75	116912	PINNACLE IMPORTS	CS	12
859481003082	y	CLOS DU MONT-OLIVET CDR VV 2012	CLOS DU MONT-OLIVET CDR VV 2012	NORTH BERKELEY IMPORTS	750 ML	18.75	116911	PINNACLE IMPORTS	CS	12
859481003259	y	ZOLO SIG. RD 2016	ZOLO SIG. RD 2016	VINO DEL SOL	750 ML	10.5	10977013	PINNACLE IMPORTS	CS	12
859481003273	y	ZOLO BLK PETIT VERDOT 2012	ZOLO BLK PETIT VERDOT 2012	VINO DEL SOL	750 ML	29.25	124410	PINNACLE IMPORTS	CS	6
859481003402	43 NOOOOOOOO	CONTERNO FANTINO BAROLO VIGNA DEL GRIS 2012	CONTERNO FANTINO BAROLO VIGNA DEL GRIS 2012	EMPSON USA INC	750 ML	74.5	1067011	PINNACLE IMPORTS	CS	6
859481003402	y	TAPIZ ALTA MALBEC 2014	TAPIZ ALTA MALBEC 2014	VINO DEL SOL	750 ML	15.75	109410	PINNACLE IMPORTS	CS	12
859481003419	y	TAPIZ ALTA CAB SAUV 2014	TAPIZ ALTA CABERNET SAUVIGNON 2014	VINO DEL SOL	750 ML	15.75	109380	PINNACLE IMPORTS	CS	12
859481003839	y	ZOLO WHT BLEND	ZOLO WHITE BLEND	VINO DEL SOL	750 ML	10.5	109771	PINNACLE IMPORTS	CS	12
859551001000	36 NOOOOOOOO	MATCHBOOK CHRDNY DUNNIGAN HILLS 2015	MATCHBOOK CHRDNY DUNNIGAN HILLS 2015	MATCHBOOK WINE CO./ CREW WINE	750 ML	14.25	121560	PINNACLE IMPORTS	CS	12
859551001017	35 NOOOOOOOO	MATCHBOOK SYRAH DUNNIGAN HILLS 2013	MATCHBOOK SYRAH DUNNIGAN HILLS 2013	MATCHBOOK WINE CO./ CREW WINE	750 ML	14.25	121550	PINNACLE IMPORTS	CS	12
859551001024	41 NOOOOOOOO	MATCHBOOK TEMPRANILLO DUNNIGAN HILLS 2012	MATCHBOOK TEMPRANILLO DUNNIGAN HILLS 2012	MATCHBOOK WINE CO./ CREW WINE	750 ML	14.25	102000	PINNACLE IMPORTS	CS	12
859551001024	41 NOOOOOOOO	BERGSTROM CUMBERLAND RESERVE PN NOIR 2015	BERGSTROM CUMBERLAND RESERVE PINOT NOIR 2015	BERGSTROM	750 ML	33.75	10440014	PINNACLE IMPORTS	CS	12
859551001031	y	MATCHBOOK TINTO REY 2012	MATCHBOOK TINTO REY 2012	MATCHBOOK WINE CO./ CREW WINE	750 ML	14.25	102010	PINNACLE IMPORTS	CS	12
859551001055	34 NOOOOOOOO	MOSSBACK CHRDNY RUSSIAN RIVER 2015	MOSSBACK CHRDNY RUSSIAN RIVER 2015	MATCHBOOK WINE CO./ CREW WINE	750 ML	15.75	102440	PINNACLE IMPORTS	CS	12
859551001079	35 NOOOOOOOO	MOSSBACK PN NOIR RUSSIAN RIVER 2015	MOSSBACK PINOT NOIR RUSSIAN RIVER 2015	MATCHBOOK WINE CO./ CREW WINE	750 ML	22.5	102461	PINNACLE IMPORTS	CS	12
859551001086	y	MOSSBACK CHALK HILL CAB 2015	MOSSBACK CHALK HILL CAB 2015	MATCHBOOK WINE CO./ CREW WINE	750 ML	22.5	102430	PINNACLE IMPORTS	CS	12
859551001161	34 NOOOOOOOO	MATCHBOOK CAB SAUV DUNN HILLS 2016	MATCHBOOK CABERNET SAUV DUNN HILLS 2016	MATCHBOOK WINE CO./ CREW WINE	750 ML	14.25	101960	PINNACLE IMPORTS	CS	12
859551001239	35 NOOOOOOOO	MOSSBACK PN NOIR CENTRAL COAST 2016	MOSSBACK PINOT NOIR CENTRAL COAST 2016	MATCHBOOK WINE CO./ CREW WINE	750 ML	15.75	102450	PINNACLE IMPORTS	CS	12
859551001291	34 NOOOOOOOO	MATCHBOOK THE ARSONIST CHRDNY 2015	MATCHBOOK THE ARSONIST CHRDNY 2015	MATCHBOOK WINE CO./ CREW WINE	750 ML	22.5	121569	PINNACLE IMPORTS	CS	12
859551001338	y	MATCHBOOK THE ARSONIST RD 2015	MATCHBOOK THE ARSONIST RD 2015	MATCHBOOK WINE CO./ CREW WINE	750 ML	22.5	127180	PINNACLE IMPORTS	CS	12
859551001352	y	MATCHBOOK RANGE 19 RD 2013 CPWM	MATCHBOOK RANGE 19 RD 2013 CPWM	MATCHBOOK WINE CO./ CREW WINE	750 ML	7.5	127170	PINNACLE IMPORTS	CS	12
859551001505	y	TINTO REY ROSE DUNNIGAN HILLS	TINTO REY ROSE DUNNIGAN HILLS	MATCHBOOK WINE CO./ CREW WINE	750 ML		1988	PINNACLE IMPORTS	CS	12
859551001611	38 NOOOOOOOO	CHASING VENUS RRV SAUV BLANC 2014 CPWM	CHASING VENUS RRV SAUVIGNON BLANC 2014 CPWM	MATCHBOOK WINE CO./ CREW WINE	750 ML	9	121568	PINNACLE IMPORTS	CS	12
859771005000	51 NOOOOOOOO	MOODY TONGUE CARAMELIZED CHOC. CHURRO BALTIC PORTER	MOODY TONGUE CARAMELIZED CHOC. CHURRO BALTIC PORTER 4PK	MOODY TONGUE BREWING CO	12 OZ		1349	PINNACLE IMPORTS	CS	24
859771005024	33 NOOOOOOOO	MOODY TONGUE SLICED NECTARINE IPA	MOODY TONGUE SLICED NECTARINE IPA 4PK	MOODY TONGUE BREWING CO	12 OZ		1348	PINNACLE IMPORTS	CS	24
859771005031	42 NOOOOOOOO	MOODY TONGUE STEEPED EMPERORS LEMON SAISON	MOODY TONGUE STEEPED EMPERORS LEMON SAISON 4PK	MOODY TONGUE BREWING CO	12 OZ		1347	PINNACLE IMPORTS	CS	24
859771005079	y	MOODY TONGUE APPLEWOOD GOLD	MOODY TONGUE APPLEWOOD GOLD 4PK	MOODY TONGUE BREWING CO	12 OZ		1346	PINNACLE IMPORTS	CS	24
859771005116	y	MOODY TONGUE APERTIF PILSNER	MOODY TONGUE APERTIF PILSNER	MOODY TONGUE BREWING CO	12 OZ		1623	PINNACLE IMPORTS	CS	24
865897000003	y	LUCKY TOWN BALLISTIC BLONDE CANS	LUCKY TOWN BALLISTIC BLONDE CANS	LUCKY TOWN BREWING COMPANY LLC	12 OZ		1665	PINNACLE IMPORTS	CS	24
865897000010	y	LUCKY TOWN PUB ALE CANS	LUCKY TOWN PUB ALE CANS	LUCKY TOWN BREWING COMPANY LLC	12 OZ		1667	PINNACLE IMPORTS	CS	24
865897000027	39 NOOOOOOOO	LUCKY TOWN FLARE INCIDENT OATMEAL STOUT	LUCKY TOWN FLARE INCIDENT OATMEAL STOUT	LUCKY TOWN BREWING COMPANY LLC	12 OZ		1671	PINNACLE IMPORTS	CS	24
865897000034	y	LUCKY TOWN HOP FIASCO IPA CANS	LUCKY TOWN HOP FIASCO IPA CANS	LUCKY TOWN BREWING COMPANY LLC	12 OZ		1669	PINNACLE IMPORTS	CS	24
865897000041	y	LUCKY TOWN GOSE GAMBLIN CANS	LUCKY TOWN GOSE GAMBLIN CANS	LUCKY TOWN BREWING COMPANY LLC	12 OZ		1673	PINNACLE IMPORTS	CS	24
865897000072	36 NOOOOOOOO	LUCKY TOWN OLD NO. 49 FARMHOUSE CANS	LUCKY TOWN OLD NO. 49 FARMHOUSE CANS	LUCKY TOWN BREWING COMPANY LLC	12 OZ		1675	PINNACLE IMPORTS	CS	24
868067000001	y	SECOND SELF RD HOP RYE CANS	SECOND SELF RD HOP RYE CANS	SECOND SELF BEER COMPANY	12 OZ		1338	PINNACLE IMPORTS	CS	24
868067000018	y	SECOND SELF THAI WHEAT CANS	SECOND SELF THAI WHEAT CANS	SECOND SELF BEER COMPANY	12 OZ		1333	PINNACLE IMPORTS	CS	24
868067000032	y	SECOND SELF CITRUS IPA CANS	SECOND SELF CITRUS IPA CANS	SECOND SELF BEER COMPANY	12 OZ		1337	PINNACLE IMPORTS	CS	24
868067000049	y	SECOND SELF MOLE PORTER CANS	SECOND SELF MOLE PORTER CANS	SECOND SELF BEER COMPANY	12 OZ		1339	PINNACLE IMPORTS	CS	24
868067000070	y	SECOND SELF AT-ALE CANS	SECOND SELF AT-ALE CANS	SECOND SELF BEER COMPANY	12 OZ		1540	PINNACLE IMPORTS	CS	24
868067000094	38 NOOOOOOOO	SECOND SELF MIG MARGARITA IN GOSE CANS	SECOND SELF MIG MARGARITA IN GOSE CANS	SECOND SELF BEER COMPANY	12 OZ		1626	PINNACLE IMPORTS	CS	24
868670000252	y	SECOND SELF MAVERICK & GOSE CANS	SECOND SELF MAVERICK & GOSE CANS	SECOND SELF BEER COMPANY	12 OZ		1334	PINNACLE IMPORTS	CS	24
872417002102	y	LA FLOR MALBEC 2016	LA FLOR MALBEC 2016	PAUL HOBBS IMPORTS	750 ML	13.5	123641	PINNACLE IMPORTS	CS	12
872417002133	y	MAS DOIX SALANQUES 2013	MAS DOIX SALANQUES 2013	EC-EUROPEAN CELLARS/ERIC SOLOMON	750 ML	31.5	120721	PINNACLE IMPORTS	CS	12
873964000016	y	CH. BELLEVUE PEYCHARNEAU 2014	CH. BELLEVUE PEYCHARNEAU 2014	AQUITAINE WINE COMPANY	750 ML	15	113260	PINNACLE IMPORTS	CS	12
873964000054	y	CH. LA FREYNELLE BLANC 2014	CH. LA FREYNELLE BLANC 2014	AQUITAINE WINE COMPANY	750 ML	12	113560	PINNACLE IMPORTS	CS	12
873964000306	y	EIEIO MERDITH MITCHELL 2005	EIEIO MERDITH MITCHELL 2005 6PK	EIEIO & COMPANY	750 ML	56.25	12245105	PINNACLE IMPORTS	CS	6
873964000306	49 NOOOOOOOO	CH. SAINT ANDRE CORBIN 2014-ST GEORGES-ST EMILION	CH. SAINT ANDRE CORBIN 2014-ST GEORGES-ST EMILION	AQUITAINE WINE COMPANY	750 ML	19.5	11401012	PINNACLE IMPORTS	CS	12
873964000306	y	VESPRES MONTSANT 2015	VESPRES MONTSANT 2015	CLASSICAL WINES	750 ML	16.5	110897	PINNACLE IMPORTS	CS	12
873964001167	y	LAROQUE CAB FRANC 2016	DOM LAROQUE CABERNET FRANC 2016	AQUITAINE WINE COMPANY	750 ML	9.75	113700	PINNACLE IMPORTS	CS	12
873964001914	y	LAROQUE CHRDNY 2015	DOM LAROQUE CHRDNY 2015	AQUITAINE WINE COMPANY	750 ML	9	127424	PINNACLE IMPORTS	CS	12
875359001974	y	DE DOLLE OERBIER11.2	DE DOLLE OERBIER 20PK/11.2	B. UNITED	11.2 OZ		301450	PINNACLE IMPORTS	CS	20
875359002544	y	GATEWAY VINHO VERDE 2011	GATEWAY VINHO VERDE 2011	BOUTIQUE	750 ML	9	108730	PINNACLE IMPORTS	CS	12
875559001943	y	DE DOLLE DULLE TEVE TRIPEL11.2	DE DOLLE DULLE TEVE TRIPEL 20PK/11.2	B. UNITED	11.2 OZ		301440	PINNACLE IMPORTS	CS	20
877591001736	33 NOOOOOOOO	SIDURI MUIRFIELD VINEYARD PN 2012	SIDURI MUIRFIELD VINEYARD PN 2012	JACKSON FAMILY WINES- SIDURI	750 ML	32.25	121312	PINNACLE IMPORTS	CS	12
877591002221	33 NOOOOOOOO	SIDURI ABRE VERT VINEYARD PN 2012	SIDURI ABRE VERT VINEYARD PN 2012	JACKSON FAMILY WINES- SIDURI	750 ML	32.25	121313	PINNACLE IMPORTS	CS	12
877591002245	y	SIDURI WILLAMETTE VALLEY PN 2016	SIDURI WILLAMETTE VALLEY PN 2016	JACKSON FAMILY WINES- SIDURI	750 ML	24.75	121314	PINNACLE IMPORTS	CS	12
877591002771	40 NOOOOOOOO	SIDURI RUSSIAN RIVER VALLEY PN NOIR 2014	SIDURI RUSSIAN RIVER VALLEY PINOT NOIR 2014	JACKSON FAMILY WINES- SIDURI	750 ML	27	121300	PINNACLE IMPORTS	CS	12
877591002931	33 NOOOOOOOO	SIDURI CHEHALEM MOUNTAINS PN 2012	SIDURI CHEHALEM MOUNTAINS PN 2012	JACKSON FAMILY WINES- SIDURI	750 ML	28	121311	PINNACLE IMPORTS	CS	12
879716000242	y	BOUSQUET RESERVE MALBEC 2013	DOM BOUSQUET RESERVE MALBEC 2013	WISD LLC	750 ML	15.75	120012	PINNACLE IMPORTS	CS	12
879716000563	y	BOUSQUET RESERVE CAB SAUV 2012	DOM BOUSQUET RESERVE CABERNET SAUVIGNON 2012	WISD LLC	750 ML	15.75	108961	PINNACLE IMPORTS	CS	12
879716000563	35 NOOOOOOOO	CLOS PISSARRA EL RAMON PRIORAT 2010	CLOS PISSARRA EL RAMON PRIORAT 2010	MIURA VINEYARDS	750 ML	24.75	110690	PINNACLE IMPORTS	CS	12
879716003076	y	BOUSQUET GAIA RD BLEND 2013	DOM BOUSQUET GAIA RD BLEND 2013	WISD (MHW/BOUSQUET)-DO NOT USE	750 ML	15.75	108962	PINNACLE IMPORTS	CS	12
890365001015	37 NOOOOOOOO	THREE SAINTS SANTA MARIA PN NOIR 2012	THREE SAINTS SANTA MARIA PINOT NOIR 2012	DIERBERG	750 ML	17.25	104060	PINNACLE IMPORTS	CS	12
890365001022	y	THREE SAINTS CAB SAUV 2013	THREE SAINTS CABERNET SAUVIGNON 2013	DIERBERG	750 ML	18	120500	PINNACLE IMPORTS	CS	12
890365001053	40 NOOOOOOOO	DIERBERG SANTA MARIA VALLEY PN NOIR 2012	DIERBERG SANTA MARIA VALLEY PINOT NOIR 2012	DIERBERG	750 ML	35.25	10089012	PINNACLE IMPORTS	CS	6
890365001077	38 NOOOOOOOO	STAR LANE HAPPY CANYON SAUV BLANC 2015	STAR LANE HAPPY CANYON SAUVIGNON BLANC 2015	DIERBERG	750 ML	18.75	116260	PINNACLE IMPORTS	CS	12
890365001084	39 NOOOOOOOO	DIERBERG SANTA MARIA VALLEY CHRDNY 2014	DIERBERG SANTA MARIA VALLEY CHRDNY 2014	DIERBERG	750 ML	26.25	11593013	PINNACLE IMPORTS	CS	12
890365001169	y	STAR LANE HAPPY CANYON CAB 2012	STAR LANE HAPPY CANYON CABERNET 2012	DIERBERG	750 ML	40.5	103370	PINNACLE IMPORTS	CS	12
891485000982	34 NOOOOOOOO	LOST VNYRDS MERLOT SOLID CASE ONLY	LOST VNYRDS MERLOT SOLID CASE ONLY	LOST VINEYARDS	750 ML	4.5	109220	PINNACLE IMPORTS	CS	12
892159000051	y	HALL NAPA SAUV BLANC 2016	HALL NAPA SAUV BLANC 2016	HALL	750 ML	20.25	10168114	PINNACLE IMPORTS	CS	12
892159000327	35 NOOOOOOOO	TENUTA ROCCA BARBERA DALBA DOC 2012	TENUTA ROCCA BARBERA DALBA DOC 2012	MARTIGNETTI CO. (VISION W&S)	750 ML	16.5	124730	PINNACLE IMPORTS	CS	6
892159000327	y	HALL NAPA MERLOT 2014	HALL NAPA MERLOT 2014	HALL	750 ML	27	100090	PINNACLE IMPORTS	CS	12
892159000570	56 NOOOOOOOO	BAYERISCHER BAHNHOF LEIPZIGER DOPPEL PORTER PORTICUS W B	BAYERISCHER BAHNHOF LEIPZIGER DOPPEL PORTER PORTICUS W/ B	B. UNITED	20 L		125292	PINNACLE IMPORTS	EA	1
892159000570	33 NOOOOOOOO	DOCKSIDE PILSNER 16BBL 5.2GAL KEG	THOMAS CREEK DOCKSIDE PILSNER 1/6BBL 5.2GAL KEG	THOMAS CREEK BREWERY	5.16667GA L		304370	PINNACLE IMPORTS	EA	1
892159000570	y	HALL CAB SAUV 2013 COSTCO	HALL CABERNET SAUVIGNON 2013 COSTCO	HALL	750 ML	43.75	10166013	PINNACLE IMPORTS	CS	12
892159000570	y	HALL NAPA VALLEY CAB SAUV 2013	HALL NAPA VALLEY CABERNET SAUVIGNON 2013	HALL	750 ML	43.75	101660131	PINNACLE IMPORTS	CS	12
892703002029	37 NOOOOOOOO	SOUTHERN STAR BOMBSHELL BLONDE 4 12OZ	SOUTHERN STAR BOMBSHELL BLONDE 4/6PK 12OZ	SOUTHERN STAR	12 OZ		300810	PINNACLE IMPORTS	CS	24
892703002036	41 NOOOOOOOO	SOUTHERN STAR BURIED HATCHET STOUT 6 12OZ	SOUTHERN STAR BURIED HATCHET STOUT 6/4PK 12OZ	SOUTHERN STAR	12 OZ		300820	PINNACLE IMPORTS	CS	24
893247000892	38 NOOOOOOOO	BIRRIFCIO ALMOND 22 HIBERNUM  1212.7OZ	BIRRIFCIO ALMOND 22 HIBERNUM / 12/12.7OZ	B. UNITED	12.7 OZ		301921	PINNACLE IMPORTS	CS	12
893568000021	y	SLODOWN SEXUAL CHOC 2015	SLODOWN SEXUAL CHOCOLATE 2015	SLO DOWN WINES	750 ML	19.5	121890	PINNACLE IMPORTS	CS	12
893940002285	y	DAMA DEL ROVERE SOAVE 2016	DAMA DEL ROVERE SOAVE 2016	NORTH BERKELEY IMPORTS	750 ML	13.5	119260	PINNACLE IMPORTS	CS	12
894185000050	40 NOOOOOOOO	COCKBURNS SPECIAL RESERVE TINS EARTHFARE	COCKBURNS SPECIAL RESERVE TINS EARTHFARE	PREMIUM PORT WINES	750 ML		105491	PINNACLE IMPORTS	CS	6
894185000623	38 NOOOOOOOO	LOST VNYRDS RD SANGRIA SOLID CASE ONLY	LOST VNYRDS RD SANGRIA SOLID CASE ONLY	LOST VINEYARDS	750 ML	6	110310	PINNACLE IMPORTS	CS	12
894185000685	39 NOOOOOOOO	LOST VNYRDS WHT SANGRIA SOLID CASE ONLY	LOST VNYRDS WHITE SANGRIA SOLID CASE ONLY	LOST VINEYARDS	750 ML	6	110350	PINNACLE IMPORTS	CS	12
894185000739	39 NOOOOOOOO	LOST VNYRDS TEMPRANILLO SOLID CASE ONLY	LOST VNYRDS TEMPRANILLO SOLID CASE ONLY	LOST VINEYARDS	750 ML	6	110370	PINNACLE IMPORTS	CS	12
894185000876	36 NOOOOOOOO	LOST VNYRDS BIANCO (SOLID CASE ONLY)	LOST VNYRDS BIANCO (SOLID CASE ONLY)	LOST VINEYARDS	750 ML	6	106110	PINNACLE IMPORTS	CS	12
894185000883	36 NOOOOOOOO	LOST VNYRDS SPUMANTE SOLID CASE ONLY	LOST VNYRDS SPUMANTE 6PK SOLID CASE ONLY	LOST VINEYARDS	750 ML	5.25	106130	PINNACLE IMPORTS	CS	6
894185000890	46 NOOOOOOOO	LOST VNYRDS ROSSO (SANGIOVESE) SOLID CASE ONLY	LOST VNYRDS ROSSO (SANGIOVESE) SOLID CASE ONLY	LOST VINEYARDS	750 ML	6	106140	PINNACLE IMPORTS	CS	12
