UPC	length	RECEIPT ALIAS	ITEM NAME	BRAND	SIZE	COST	SUID	VENDOR	UOM	PACK
791930001426	36 NOOOOOOOO	CH. GREFFIERE MACON-LA ROCHE VV 2016	CH. GREFFIERE MACON-LA ROCHE VV 2016	WEYGANDT-METZLER IMPORTING	750 ML	15.75	124360	PINNACLE IMPORTS	CS	12
791930001570	36 NOOOOOOOO	DU VISSOUX CHERMETTE BEAUJOLAIS 2016	DOM DU VISSOUX CHERMETTE BEAUJOLAIS 2016	WEYGANDT-METZLER IMPORTING	750 ML	13.5	113150	PINNACLE IMPORTS	CS	12
791930001730	43 NOOOOOOOO	LES APHILLANTHES CDR GALLETS PLAN DIEU 2016	DOM LES APHILLANTHES CDR GALLETS PLAN DIEU 2016	WEYGANDT-METZLER IMPORTING	750 ML	16.5	111280	PINNACLE IMPORTS	CS	12
791930002492	y	REVERDY SANCERRE LES COUTES 2016	REVERDY SANCERRE LES COUTES 2016	WEYGANDT-METZLER IMPORTING	750 ML	22	11705013	PINNACLE IMPORTS	CS	12
791930002553	33 NOOOOOOOO	SERGE DAGUENEAU POUILLY FUME 2016	SERGE DAGUENEAU POUILLY FUME 2016	WEYGANDT-METZLER IMPORTING	750 ML	20.25	11708012	PINNACLE IMPORTS	CS	12
791930003291	38 NOOOOOOOO	BONNET-HUTEAU MUSCADET LES LAURES 2014	BONNET-HUTEAU MUSCADET LES LAURES 2014	WEYGANDT-METZLER IMPORTING	750 ML	14.25	124010	PINNACLE IMPORTS	CS	12
793573188007	54 NOOOOOOOO	LIVERA GEVREY-CHAMBERTIN LES EVOCELLES RESERVE VV 2010	LIVERA GEVREY-CHAMBERTIN LES EVOCELLES RESERVE VV 2010	NORTH BERKELEY IMPORTS	750 ML	49.5	117200	PINNACLE IMPORTS	CS	12
794504454925	47 NOOOOOOOO	KNEE DEEP CITRA EXTRA PALE ALE (BOMBER)  1222OZ	KNEE DEEP CITRA EXTRA PALE ALE (BOMBER) / 12/22OZ	KNEE DEEP BREWING CO.	22 OZ		127210	PINNACLE IMPORTS	CS	12
797822684586	55 NOOOOOOOO	HOPPIN FROG GRAPEFRUIT TURBO SHANDY CITRUS ALE CANS(LR)	HOPPIN FROG GRAPEFRUIT TURBO SHANDY CITRUS ALE CANS(LR)	HOPPIN FROG BREWERY	12 OZ		1730	PINNACLE IMPORTS	CS	24
798304208825	y	HOPPIN FROG GANGSTER FROG IPA	HOPPIN FROG GANGSTER FROG IPA	HOPPIN FROG BREWERY	22 OZ		120360	PINNACLE IMPORTS	CS	12
801740024680	y	CASA E DI MIRAFIORE BAROLO DOCG	CASA E DI MIRAFIORE BAROLO DOCG	DOMAINE SELECT WINE ESTATE	750 ML	31.5	106845	PINNACLE IMPORTS	CS	12
801740079808	47 NOOOOOOOO	CASA E DI MIRAFIORE BARBERA DALBA DOC SUPERIORE	CASA E DI MIRAFIORE BARBERA DALBA DOC SUPERIORE	DOMAINE SELECT WINE ESTATE	750 ML	20.25	106847	PINNACLE IMPORTS	CS	12
801740079976	39 NOOOOOOOO	CASA E DI MIRAFIORE LANGHE NEBBIOLO DOC	CASA E DI MIRAFIORE LANGHE NEBBIOLO DOC	DOMAINE SELECT WINE ESTATE	750 ML	25.5	106846	PINNACLE IMPORTS	CS	12
804551312052	36 NOOOOOOOO	HOPPIN FROG BARREL AGED TURBO SHANDY	HOPPIN FROG BARREL AGED TURBO SHANDY	HOPPIN FROG BREWERY	22 OZ		120375	PINNACLE IMPORTS	CS	12
804551312113	51 NOOOOOOOO	HOPPIN FROG KILLA VANILLA EXTRAORDINARY VANILLA IPA	HOPPIN FROG KILLA VANILLA EXTRAORDINARY VANILLA IPA	HOPPIN FROG BREWERY	22 OZ		120377	PINNACLE IMPORTS	CS	12
804879126379	y	ILLAHE WILLAMETTE PN NOIR 2016	ILLAHE WILLAMETTE PINOT NOIR 2016	ILLAHE	750 ML	18.75	119474	PINNACLE IMPORTS	CS	12
804879154082	40 NOOOOOOOO	ILLAHE WILLAMETTE ESTATE PINOT GRIS 2016	ILLAHE WILLAMETTE ESTATE PINOT GRIS 2016	ILLAHE	750 ML	15	119472	PINNACLE IMPORTS	CS	12
804879154105	33 NOOOOOOOO	HYLAND ESTATES COURY PN NOIR 2013	HYLAND ESTATES COURY PINOT NOIR 2013	HYLAND ESTATES	750 ML	48	12587313	PINNACLE IMPORTS	CS	12
804879154105	y	ILLAHE VIOGNIER 2016	ILLAHE VIOGNIER 2016	ILLAHE	750 ML	15	119470	PINNACLE IMPORTS	CS	12
804879154112	35 NOOOOOOOO	ILLAHE ESTATE GRUNER VELTLINER 2015	ILLAHE ESTATE GRUNER VELTLINER 2015	ILLAHE	750 ML	15	119471	PINNACLE IMPORTS	CS	12
805109112124	y	CASTANO SOLANERA 2013	CASTANO SOLANERA 2013	EC-EUROPEAN CELLARS/ERIC SOLOMON	750 ML	12.75	120750	PINNACLE IMPORTS	CS	12
805109112247	y	CASTANO MONASTRELL 2014 DI	CASTANO MONASTRELL 2014 DI	EC-EUROPEAN CELLARS/ERIC SOLOMON	750 ML	9	12075114	PINNACLE IMPORTS	CS	12
805109134065	38 NOOOOOOOO	DOMAINE LA GARRIGUE VACQUEYRAS 2015 DI	DOMAINE LA GARRIGUE VACQUEYRAS 2015 DI	EC-EUROPEAN CELLARS/ERIC SOLOMON	750 ML	18	12060113	PINNACLE IMPORTS	CS	12
805109134089	39 NOOOOOOOO	DOMAINE LA GARRIGUE CDR ROMAINE 2015 DI	DOMAINE LA GARRIGUE CDR ROMAINE 2015 DI	EC-EUROPEAN CELLARS/ERIC SOLOMON	750 ML	13.5	12059013	PINNACLE IMPORTS	CS	12
805109187016	y	NOVELLUM CHRDNY 2016 DI	NOVELLUM CHRDNY 2016 DI	EC-EUROPEAN CELLARS/ERIC SOLOMON	750 ML	11.25	12086013	PINNACLE IMPORTS	CS	12
805109190115	y	GRAMONA GESSAMI ORG 2016 DI	GRAMONA GESSAMI ORG 2016 DI	EC-EUROPEAN CELLARS/ERIC SOLOMON	750 ML	15	120871	PINNACLE IMPORTS	CS	12
805109340015	45 NOOOOOOOO	WILLIAM FEVRE DOMAINE LES CLOS GRAND CRU 2014	WILLIAM FEVRE DOMAINE LES CLOS GRAND CRU 2014	HENRIOT INC.	750 ML	99	122141	PINNACLE IMPORTS	CS	12
805109340015	y	LAFAGE COTE DEST 2015 DI	LAFAGE COTE DEST 2015 DI	EC-EUROPEAN CELLARS/ERIC SOLOMON	750 ML	11.25	12088015	PINNACLE IMPORTS	CS	12
805109340022	y	LAFAGE CUVEE CENTENAIRE 2015 DI	LAFAGE CUVEE CENTENAIRE 2015 DI	EC-EUROPEAN CELLARS/ERIC SOLOMON	750 ML	12	120641	PINNACLE IMPORTS	CS	12
805109340039	37 NOOOOOOOO	LAFAGE CUVEE NICOLAS GRENACHE 2014 DI	LAFAGE CUVEE NICOLAS GRENACHE 2014 DI	EC-EUROPEAN CELLARS/ERIC SOLOMON	750 ML	13.5	120631	PINNACLE IMPORTS	CS	12
805109340053	y	LAFAGE COTE SUD 2008 DI	LAFAGE COTE SUD 2008 DI	EC-EUROPEAN CELLARS/ERIC SOLOMON	750 ML	12	111760	PINNACLE IMPORTS	CS	12
805109445017	y	ESPELT CORALI ROSE 2015	ESPELT CORALI ROSE 2015	EC-EUROPEAN CELLARS/ERIC SOLOMON	750 ML	10.5	110591	PINNACLE IMPORTS	CS	12
805109445055	y	ESPELT VAILLET 2013 DI	ESPELT VAILLET 2013 DI	EC-EUROPEAN CELLARS/ERIC SOLOMON	750 ML	10.5	11060013	PINNACLE IMPORTS	CS	12
805109446014	37 NOOOOOOOO	RAFAEL PALACIOS LOURO GODELLO 2016 DI	RAFAEL PALACIOS LOURO GODELLO 2016 DI	EC-EUROPEAN CELLARS/ERIC SOLOMON	750 ML	18	12080013	PINNACLE IMPORTS	CS	12
805109990012	y	CUVEE FRDDY 2411.2OZ	CUVEE FRDDY 24/11.2OZ	B. UNITED	11.2 OZ		119850	PINNACLE IMPORTS	CS	24
805109990012	y	ALTOVINUM EVODIA 2016 DI	ALTOVINUM EVODIA 2016 DI	EC-EUROPEAN CELLARS/ERIC SOLOMON	750 ML	9.75	12095013	PINNACLE IMPORTS	CS	12
811258020050	33 NOOOOOOOO	THE DISTRICT MERLOT OAKVILLE 2013	THE DISTRICT MERLOT OAKVILLE 2013	UNUM WINE CELLARS LLC	750 ML	33	124772	PINNACLE IMPORTS	CS	12
811387013800	36 NOOOOOOOO	LOST VNYRDS CAB SAUV SOLID CASE ONLY	LOST VNYRDS CABERNET SAUVIGNON SOLID CASE ONLY	LOST VINEYARDS	750 ML	4.5	109190	PINNACLE IMPORTS	CS	12
811387014111	38 NOOOOOOOO	LOST TREE HUGGER ROSSO SOLID CASE ONLY	LOST TREE HUGGER ROSSO SOLID CASE ONLY	LOST VINEYARDS	750 ML	7	106090	PINNACLE IMPORTS	CS	12
811387014159	y	CASSAGNOLES GASCOGNE ROSE 2016	CASSAGNOLES GASCOGNE ROSE 2016	WEYGANDT-METZLER IMPORTING	750 ML	8.5	112992	PINNACLE IMPORTS	CS	12
811387015071	y	LOST TREE HUGGER BIANCO	LOST TREE HUGGER BIANCO	LOST VINEYARDS	750 ML	7	106100	PINNACLE IMPORTS	CS	12
811387015743	54 NOOOOOOOO	LOST VNYRDS WHT SANGRIA 500ML (PLASTIC BTL) SOLID CASE	LOST VNYRDS WHITE SANGRIA 500ML (PLASTIC BTL) SOLID CASE	LOST VINEYARDS	500 ML	4.5	110360	PINNACLE IMPORTS	CS	12
811387016887	41 NOOOOOOOO	LOST VNYRDS BERRY SANGRIA SOLID CASE ONLY	LOST VNYRDS BERRY SANGRIA SOLID CASE ONLY	LOST VINEYARDS	750 ML	6	110311	PINNACLE IMPORTS	CS	12
811882008127	y	CH. FLEUR CARDINALE LA 2011	CH. FLEUR CARDINALE LA 2011	AUDY	750 ML	42	113520	PINNACLE IMPORTS	CS	12
811882008219	y	CH. FARGUES SAUTERNES 375ML 2005	CH. FARGUES SAUTERNES 375ML 24PK 2005	PINNACLE IMPORTS	375 ML	67.5	113510	PINNACLE IMPORTS	CS	24
811981008219	y	DE DOLLE BOSKEUN11.2	DE DOLLE BOSKEUN 20PK/11.2	B. UNITED	11.2 OZ		301430	PINNACLE IMPORTS	CS	20
814378000407	y	CASA CASTILLO MONASTRELL 2015 DI	CASA CASTILLO MONASTRELL 2015 DI	EC-EUROPEAN CELLARS/ERIC SOLOMON	750 ML	11.25	120730	PINNACLE IMPORTS	CS	12
815271020004	y	DURIN PIGATO 2014	DURIN PIGATO 2014	NORTH BERKELEY IMPORTS	750 ML	17.25	126830	PINNACLE IMPORTS	CS	12
815541000552	35 NOOOOOOOO	MONTESE CONDO ROSSO IGT TOSCANA2011	MONTESE CONDO ROSSO IGT TOSCANA2011	LOUIS-DRESSNER	750 ML	16	107210	PINNACLE IMPORTS	CS	12
815770010261	y	STEELHEAD CHARD 2015 1875ML	STEELHEAD CHARD 2015 1875ML	V2 WINE GROUP	187.5 ML	4.5	123321	PINNACLE IMPORTS	CS	24
815770010278	y	STEELHEAD SONOMA MERLOT 187ML	STEELHEAD SONOMA MERLOT 187ML	V2 WINE GROUP	187.5 ML	4.5	123322	PINNACLE IMPORTS	CS	24
831803003017	y	NADIA CAB SAUV 2015	NADIA CABERNET SAUVIGNON 2015	LAETITIA VINEYARD & WINERY	750 ML	20.25	101918	PINNACLE IMPORTS	CS	12
831803003031	y	NADIA SAUV BLANC 2015	NADIA SAUVIGNON BLANC 2015	LAETITIA VINEYARD & WINERY	750 ML	14.25	101919	PINNACLE IMPORTS	CS	12
835207000023	y	SPY VALLEY SAUV BLANC 2016	SPY VALLEY SAUV BLANC 2016	BROADBENT SELECTIONS	750 ML	15.75	108020	PINNACLE IMPORTS	CS	12
835207001013	y	SPY VALLEY PN NOIR 2013	SPY VALLEY PINOT NOIR 2013	BROADBENT SELECTIONS	750 ML	21.75	108010	PINNACLE IMPORTS	CS	12
835207001020	46 NOOOOOOOO	CHATEAU EXTRAVAGANT DE DOISEY DAENE 375ML 2007	CHATEAU EXTRAVAGANT DE DOISEY DAENE 375ML 1PK 2007	AUDY	375 ML	236.5	113480	PINNACLE IMPORTS	EA	1
835207003017	y	SPY VALLEY ENVOY PINOT GRIS 2008	SPY VALLEY ENVOY PINOT GRIS 2008 6PK	BROADBENT SELECTIONS	750 ML	24.75	107990	PINNACLE IMPORTS	CS	6
835207003017	34 NOOOOOOOO	CHATEAU DE MANISSY TAVEL ROSE 2016	CHATEAU DE MANISSY TAVEL ROSE 2016	WEYGANDT-METZLER IMPORTING	750 ML	17.25	111297	PINNACLE IMPORTS	CS	12
835603001013	y	BENMARCO MALBEC 2014	BENMARCO MALBEC 2014	FOLIO WINE COMPANY LLC	750 ML	16.5	109340	PINNACLE IMPORTS	CS	12
835603001075	y	LUCA CHRDNY 2013	LUCA CHRDNY 2013	VINE CONNECTIONS	750 ML	27	10907011	PINNACLE IMPORTS	CS	12
835603001082	y	LUCA MALBEC 2014	LUCA MALBEC 2014	VINE CONNECTIONS	750 ML	27.75	109080	PINNACLE IMPORTS	CS	12
835603001105	37 NOOOOOOOO	LUCA SYRAH LABORDE DOUBLE SELECT 2011	LUCA SYRAH LABORDE DOUBLE SELECT 2011	VINE CONNECTIONS	750 ML	23.25	109050	PINNACLE IMPORTS	CS	12
835603001167	y	TIKAL AMORIO 2014	TIKAL AMORIO 2014	VINE CONNECTIONS	750 ML	24.75	10953011	PINNACLE IMPORTS	CS	12
835603001174	36 NOOOOOOOO	TIKAL PATRIOTA BONARDA - MALBEC 2014	TIKAL PATRIOTA BONARDA - MALBEC 2014	VINE CONNECTIONS	750 ML	17.25	10955012	PINNACLE IMPORTS	CS	12
835603001198	y	CLOS PISSARRA CLOS D OC 2009	CLOS PISSARRA CLOS D OC 2009	MIURA VINEYARDS	750 ML	40	119331	PINNACLE IMPORTS	CS	12
835603001259	y	LA POSTA BONARDA 2013	LA POSTA BONARDA 2013	VINE CONNECTIONS	750 ML	14.25	109270	PINNACLE IMPORTS	CS	12
835603001259	35 NOOOOOOOO	LA COLLIERE RASTEAU LES TROUILLERES	DOM LA COLLIERE RASTEAU LES TROUILLERES	EC-EUROPEAN CELLARS/ERIC SOLOMON	750 ML	15.75	124691	PINNACLE IMPORTS	CS	12
835603001303	y	BENMARCO CAB SAUV 2012	BENMARCO CABERNET SAUVIGNON 2012	FOLIO WINE COMPANY LLC	750 ML	16.5	109330	PINNACLE IMPORTS	CS	12
835603001303	45 NOOOOOOOO	CONRERIA DSCALA DEI BLK SLATE LA MORERA BLANC	CONRERIA DSCALA DEI BLK SLATE LA MORERA BLANC	EC-EUROPEAN CELLARS/ERIC SOLOMON	750 ML	17.25	124702	PINNACLE IMPORTS	CS	12
835603001310	y	LA POSTA PIZZELLA MALBEC 2015	LA POSTA PIZZELLA MALBEC 2015	VINE CONNECTIONS	750 ML	15	109310	PINNACLE IMPORTS	CS	12
835603001372	y	MENDEL MALBEC 2015	MENDEL MALBEC 2015	VINE CONNECTIONS	750 ML	20.25	10924012	PINNACLE IMPORTS	CS	12
835603001396	54 NOOOOOOOO	LA POSTA COCINA 2015- TINTO MALBEC BONARDA SYRAH BLEND	LA POSTA COCINA 2015- TINTO MALBEC BONARDA SYRAH BLEND	VINE CONNECTIONS	750 ML	12	109290	PINNACLE IMPORTS	CS	12
835603001396	46 NOOOOOOOO	COLLOSORBO BRUNELLO DI MONTALCINO RISERVA 2006	COLLOSORBO BRUNELLO DI MONTALCINO RISERVA 2006	NORTH BERKELEY IMPORTS	750 ML	72	123880	PINNACLE IMPORTS	CS	12
835603001396	35 NOOOOOOOO	COLLOSORBO ROSSO DI MONTALCINO 2012	COLLOSORBO ROSSO DI MONTALCINO 2012	NORTH BERKELEY IMPORTS	750 ML	26.25	123881	PINNACLE IMPORTS	CS	12
835603001679	y	CORISON NAPA CAB 2014	CORISON NAPA CAB 2014	CORISON WINES	750 ML	74.25	100790	PINNACLE IMPORTS	CS	12
835603001839	y	BODINI MALBEC 2016	BODINI MALBEC 2016	VINE CONNECTIONS	750 ML	9.75	108860	PINNACLE IMPORTS	CS	12
835603002614	y	CRIOS MALBEC 2016	CRIOS MALBEC 2016	FOLIO WINE COMPANY LLC	750 ML	11.25	108900	PINNACLE IMPORTS	CS	12
835603002621	y	MAYU PEDRO XIMENEZ 2016	MAYU PEDRO XIMENEZ 2016	VINE CONNECTIONS	750 ML	9.75	109263	PINNACLE IMPORTS	CS	12
835603002638	y	MAYU SAUV BLANC 2016	MAYU SAUVIGNON BLANC 2016	VINE CONNECTIONS	750 ML	9.75	109262	PINNACLE IMPORTS	CS	12
835603002645	y	MAYU CARMENERE  SYRAH 2012	MAYU CARMENERE / SYRAH 2012	VINE CONNECTIONS	750 ML	11.25	109264	PINNACLE IMPORTS	CS	12
835603002645	y	MAYU CARMENERE  SYRAH 2014 WF	MAYU CARMENERE / SYRAH 2014 WF	VINE CONNECTIONS	750 ML	11.25	127280	PINNACLE IMPORTS	CS	12
835603002928	y	BOYA ROSE 2016	BOYA ROSE 2016	VINE CONNECTIONS	750 ML	11.25	1430	PINNACLE IMPORTS	CS	12
835603003455	y	WELL OF WISSAKE 300ML ( GINJO)	WELL OF WISDOM SAKE 300ML ( GINJO)	VINE CONNECTIONS	300 ML	10.5	107890	PINNACLE IMPORTS	CS	12
835603005028	41 NOOOOOOOO	SOUTHERN BEAUTY SAKE 720ML (JUNMAI GINJO)	SOUTHERN BEAUTY SAKE 720ML (JUNMAI GINJO) 6PK	VINE CONNECTIONS	720 ML	33	107800	PINNACLE IMPORTS	CS	6
835603005028	y	CH. VIEUX PALON 2010	CH. VIEUX PALON 2010	PINNACLE IMPORTS	750 ML	21.75	114080	PINNACLE IMPORTS	CS	12
835603005035	41 NOOOOOOOO	STAR FILLED SKY SAKE 720ML (JUNMAI GINJO)	STAR FILLED SKY SAKE 720ML (JUNMAI GINJO) 6PK	VINE CONNECTIONS	720 ML	26.25	107760	PINNACLE IMPORTS	CS	6
835603005103	33 NOOOOOOOO	DREAMY CLOUDS SAKE 720ML (NIGORI)	DREAMY CLOUDS SAKE 720ML (NIGORI) 6PK	VINE CONNECTIONS	720 ML	26.25	107780	PINNACLE IMPORTS	CS	6
835603005103	38 NOOOOOOOO	CH. TROPLONG MONDOT SAINT EMILION 2006	CH. TROPLONG MONDOT SAINT EMILION 2006	PINNACLE IMPORTS	750 ML	168	114040	PINNACLE IMPORTS	CS	12
835603005127	46 NOOOOOOOO	MOON ON THE WATER SAKE 300ML (JUNMAI DAIGINJO)	MOON ON THE WATER SAKE 300ML (JUNMAI DAIGINJO)	VINE CONNECTIONS	300 ML	15	126472	PINNACLE IMPORTS	CS	12
835603005134	44 NOOOOOOOO	DIVINE DROPLETS SAKE 300ML (JUNMAI DAIJINJO)	DIVINE DROPLETS SAKE 300ML (JUNMAI DAIJINJO)	VINE CONNECTIONS	300 ML	24	107810	PINNACLE IMPORTS	CS	12
835603005158	41 NOOOOOOOO	STAR FILLED SKY SAKE 300ML (JUNMAI GINJO)	STAR FILLED SKY SAKE 300ML (JUNMAI GINJO)	VINE CONNECTIONS	300 ML	13.5	107750	PINNACLE IMPORTS	CS	12
835603005219	33 NOOOOOOOO	DREAMY CLOUDS SAKE 300ML (NIGORI)	DREAMY CLOUDS SAKE 300ML (NIGORI)	VINE CONNECTIONS	300 ML	12	107770	PINNACLE IMPORTS	CS	12
835603005295	y	WELL OF WISSAKE 720ML ( GINJO)	WELL OF WISDOM SAKE 720ML ( GINJO) 6PK	VINE CONNECTIONS	720 ML	19.5	107880	PINNACLE IMPORTS	CS	6
835603005295	40 NOOOOOOOO	CHARBONNIERE CDP HAUTES BRUSQUIERES 2013	CHARBONNIERE CDP HAUTES BRUSQUIERES 2013	WINES OF FRANCE	750 ML	45	121781	PINNACLE IMPORTS	CS	12
835603005387	42 NOOOOOOOO	BRIDE OF THE FOX SAKE 720ML (JUNMAI GINJO)	BRIDE OF THE FOX SAKE 720ML (JUNMAI GINJO) 6PK	VINE CONNECTIONS	720 ML	26.25	107730	PINNACLE IMPORTS	CS	6
835603005417	y	LIVING JEWEL SAKE 300ML (JUNMAI)	LIVING JEWEL SAKE 300ML (JUNMAI)	VINE CONNECTIONS	300 ML	9	107830	PINNACLE IMPORTS	CS	12
835603005424	y	LIVING JEWEL SAKE 720ML (NIGORI)	LIVING JEWEL SAKE 720ML (NIGORI) 6PK	VINE CONNECTIONS	720 ML	14.25	107820	PINNACLE IMPORTS	CS	6
835603005431	y	SNOW MAIDEN SAKE 720ML (NIGORI)	SNOW MAIDEN SAKE 720ML (NIGORI) 6PK	VINE CONNECTIONS	720 ML	14.25	107840	PINNACLE IMPORTS	CS	6
835603005448	y	SNOW MAIDEN SAKE 300ML (NIGORI)	SNOW MAIDEN SAKE 300ML (NIGORI)	VINE CONNECTIONS	300 ML	9	107850	PINNACLE IMPORTS	CS	12
835603005554	49 NOOOOOOOO	PEARLS OF SIMPLICITY SAKE 300ML (JUNMAI DAIGINJO)	PEARLS OF SIMPLICITY SAKE 300ML (JUNMAI DAIGINJO)	VINE CONNECTIONS	300 ML	15	126470	PINNACLE IMPORTS	CS	12
835603006247	y	LEWELLING NAPA CAB 2013	LEWELLING NAPA CAB 2013	VINE CONNECTIONS	750 ML	58	121420	PINNACLE IMPORTS	CS	12
839146005408	43 NOOOOOOOO	FR BROAD ANVIL PORTER 12 BARREL 15.5 GALLON	FRENCH BROAD ANVIL PORTER 1/2 BARREL 15.5 GALLON	FRENCH BROAD BREWERY	1/2 BB L		303731	PINNACLE IMPORTS	EA	1
839146005408	35 NOOOOOOOO	RAY STATION MERLOT NORTH COAST 2014	RAY STATION MERLOT NORTH COAST 2014	VINTAGE WINE ESTATES	750 ML	13.5	116230	PINNACLE IMPORTS	CS	12
839146006580	y	RAY STATION CAB 2014	RAY STATION CAB 2014	VINTAGE WINE ESTATES	750 ML	13.5	121940	PINNACLE IMPORTS	CS	12
839146007785	y	COSENTINO THE BLANC 16	COSENTINO THE BLANC 16	VINTAGE WINE ESTATES	750 ML	12.75	100643	PINNACLE IMPORTS	CS	12
839146007792	y	COSENTINO THE RD 2015	COSENTINO THE RD 2015	VINTAGE WINE ESTATES	750 ML	12.75	100642	PINNACLE IMPORTS	CS	12
839411000633	y	COLLEMASSARI ROSSO RISERVA 2013	COLLEMASSARI ROSSO RISERVA 2013	DOMAINE SELECT WINE ESTATE	750 ML	21.75	126992	PINNACLE IMPORTS	CS	6
839411000732	36 NOOOOOOOO	COLLEMASSARI MELACCE VERMENTINO 2015	COLLEMASSARI MELACCE VERMENTINO 2015	DOMAINE SELECT WINE ESTATE	750 ML	15	126990	PINNACLE IMPORTS	CS	6
839543001218	45 NOOOOOOOO	CASTELLO DELLA PANERETTA CANAIOLO ROSATO 2012	CASTELLO DELLA PANERETTA CANAIOLO ROSATO 2012	NORTH BERKELEY IMPORTS	750 ML	13.5	107130	PINNACLE IMPORTS	CS	12
839543001218	y	PRIMATERRA PINOT GRIGIO 2016	PRIMATERRA PINOT GRIGIO 2016	DOMAINE SELECT WINE ESTATE	750 ML	9.75	106170	PINNACLE IMPORTS	CS	12
839543001225	41 NOOOOOOOO	FONTANAFRDDA BARBERA BRICCOTONDO DOC 2015	FONTANAFRDDA BARBERA BRICCOTONDO DOC 2015	PALM BAY INTERNATIONAL	750 ML	13.5	10682012	PINNACLE IMPORTS	CS	12
839543001256	y	PRIMATERRA SANGIOVESE IGT 2016	PRIMATERRA SANGIOVESE IGT 2016	DOMAINE SELECT WINE ESTATE	750 ML	9.75	106210	PINNACLE IMPORTS	CS	12
839543001263	y	CAVITTORIA PROSECCO BRUT DOCG	CAVITTORIA PROSECCO BRUT DOCG	NORTH BERKELEY IMPORTS	750 ML	16.5	125540	PINNACLE IMPORTS	CS	12
839543001270	35 NOOOOOOOO	CDR CRK PATIOPOUNDER PALE LAGER KEG	CEDAR CREEK PATIOPOUNDER PALE LAGER KEG	CEDAR CREEK BREWERY	5.16667GA L		127011	PINNACLE IMPORTS	EA	1
839543001294	y	PRIMATERRA PRIMITIVO 2016	PRIMATERRA PRIMITIVO 2016	DOMAINE SELECT WINE ESTATE	750 ML	9.75	116500	PINNACLE IMPORTS	CS	12
839543001744	35 NOOOOOOOO	BASTIDE BLANCHE CASTILLON ROSE 2016	DOM BASTIDE BLANCHE CASTILLON ROSE 2016	WEYGANDT-METZLER IMPORTING	750 ML		111292	PINNACLE IMPORTS	CS	12
839543001744	y	PRIMATERRA PROSECCO NV	PRIMATERRA PROSECCO NV	DOMAINE SELECT WINE ESTATE	750 ML	10.5	106190	PINNACLE IMPORTS	CS	12
843304000020	35 NOOOOOOOO	HENRIOT SOUVERAIN BRUT CHAMPAGNE NV	HENRIOT SOUVERAIN BRUT CHAMPAGNE NV	HENRIOT INC.	750 ML	48	111930	PINNACLE IMPORTS	CS	12
843304000181	y	HENRIOT ROSE CHAMPAGNE NV	HENRIOT ROSE CHAMPAGNE NV	HENRIOT INC.	750 ML	59.25	111950	PINNACLE IMPORTS	CS	12
843304000181	y	DOMAINE DE MARCOUX CDP VV 2004	DOMAINE DE MARCOUX CDP VV 2004	EC-EUROPEAN CELLARS/ERIC SOLOMON	750 ML	105.56	125050	PINNACLE IMPORTS	CS	12
843304000501	41 NOOOOOOOO	HENRIOT BLANC DE BLANC CHAMPAGNE 375ML NV	HENRIOT BLANC DE BLANC CHAMPAGNE 375ML NV	HENRIOT INC.	375 ML	31.5	111890	PINNACLE IMPORTS	CS	12
843304000501	y	ST DAMIEN GIGONDAS 2014	DOM ST DAMIEN GIGONDAS 2014	WEYGANDT-METZLER IMPORTING	750 ML	25.75	12400012	PINNACLE IMPORTS	CS	12
843304000525	45 NOOOOOOOO	HENRIOT SOUVERAIN BLANC DE BLANC CHAMPAGNE NV	HENRIOT SOUVERAIN BLANC DE BLANC CHAMPAGNE NV	HENRIOT INC.	750 ML	57.75	111900	PINNACLE IMPORTS	CS	12
843304015888	y	BOUCHARD POUILLY-FUISSE 2015	BOUCHARD POUILLY-FUISSE 2015	HENRIOT INC.	750 ML	22.5	11560012	PINNACLE IMPORTS	CS	12
843304017615	y	GLAZEN SAISON DERPE MERE 20L	GLAZEN SAISON DERPE MERE 20L	B. UNITED	20 L		302771	PINNACLE IMPORTS	EA	1
843304018995	y	BOUCHARD CHRDNY 2015	BOUCHARD CHRDNY 2015	HENRIOT INC.	750 ML	18.75	112540	PINNACLE IMPORTS	CS	12
843304019411	y	BOUCHARD PN NOIR 2015	BOUCHARD PINOT NOIR 2015	HENRIOT INC.	750 ML	18.75	112550	PINNACLE IMPORTS	CS	12
843304023920	34 NOOOOOOOO	WILLIAM FEVRE CHABLIS DOMAINE 2016	WILLIAM FEVRE CHABLIS DOMAINE 2016	HENRIOT INC.	750 ML	24.75	122140	PINNACLE IMPORTS	CS	12
843304039006	y	VILLA PONCIAGO FLEURIE 2011	VILLA PONCIAGO FLEURIE 2011	HENRIOT INC.	750 ML	18	11256011	PINNACLE IMPORTS	CS	12
843304039501	35 NOOOOOOOO	RESERVE DES BERTRANDS ELEGANCE ROSE	RESERVE DES BERTRANDS ELEGANCE ROSE	HENRIOT INC.	750 ML	13	1388	PINNACLE IMPORTS	CS	6
843304039549	y	CH. BERTRANDS ESTATE ROSE 2016	CH. BERTRANDS ESTATE ROSE 2016	HENRIOT INC.	750 ML	16.92	1389	PINNACLE IMPORTS	CS	6
843304040248	37 NOOOOOOOO	CH. LACOSTE LA GRANDE PIECE ROSE 2012	CH. LACOSTE LA GRANDE PIECE ROSE 2012	WEYGANDT-METZLER IMPORTING	750 ML	12.75	119220	PINNACLE IMPORTS	CS	12
843700674405	y	XILOCA GARNACHA 2014	XILOCA GARNACHA 2014	CLASSICAL WINES	750 ML	11.25	110940	PINNACLE IMPORTS	CS	12
850001000024	y	RAPTOR RIDGE PINOT GRIS 2015	RAPTOR RIDGE PINOT GRIS 2015	RAPTOR RIDGE	750 ML	15	10497013	PINNACLE IMPORTS	CS	12
850001000055	y	RAPTOR RIDGE SHEA PN NOIR 2013	RAPTOR RIDGE SHEA PINOT NOIR 2013	RAPTOR RIDGE	750 ML	43.5	116460	PINNACLE IMPORTS	CS	12
850001000086	39 NOOOOOOOO	RAPTOR RIDGE BARREL SELECT PN NOIR 2014	RAPTOR RIDGE BARREL SELECT PINOT NOIR 2014	RAPTOR RIDGE	750 ML	21.75	10498013	PINNACLE IMPORTS	CS	12
850254003056	y	PELAQUIE ROUGE LAUDIN 2011	DOM PELAQUIE ROUGE LAUDIN 2011	PRISM	750 ML	12	120971	PINNACLE IMPORTS	CS	12
850254003070	y	MILE POST PN NOIR 2015	MILE POST PINOT NOIR 2015	R STUART & CO	750 ML	15	104880	PINNACLE IMPORTS	CS	12
850254003087	y	MILE POST PINOT GRIS 2014	MILE POST PINOT GRIS 2014	R STUART & CO	750 ML	12.75	104860	PINNACLE IMPORTS	CS	12
850254003100	y	MILE MARKER RIESLING 2011	MILE MARKER RIESLING 2011	R STUART & CO	750 ML	12.75	116430	PINNACLE IMPORTS	CS	12
850294000015	y	R. STUART BIG FIRE PN NOIR 2015	R. STUART BIG FIRE PINOT NOIR 2015	R STUART & CO	750 ML	15.75	104340	PINNACLE IMPORTS	CS	12
850294000015	y	BRAMARE MALBEC VALLE DE UCO 2013	BRAMARE MALBEC VALLE DE UCO 2013	PAUL HOBBS IMPORTS	750 ML	33.75	11545012	PINNACLE IMPORTS	CS	12
850294000022	34 NOOOOOOOO	R. STUART BIG FIRE PINOT GRIS 2015	R. STUART BIG FIRE PINOT GRIS 2015	R STUART & CO	750 ML	15.75	121870	PINNACLE IMPORTS	CS	12
850294000039	y	R. STUART AUTOGRAPH PN NOIR 2013	R. STUART AUTOGRAPH PINOT NOIR 2013	R STUART & CO	750 ML	40.5	10437112	PINNACLE IMPORTS	CS	12
850294000046	y	R. STUART BIG FIRE ROSE 2014	R. STUART BIG FIRE ROSE 2014	R STUART & CO	750 ML	13.75	10436013	PINNACLE IMPORTS	CS	12
850294000060	y	R. STUART LOVE PN NOIR 2014	R. STUART LOVE PINOT NOIR 2014	R STUART & CO	750 ML	22.5	104376	PINNACLE IMPORTS	CS	12
850294000091	y	R. STUART LOVE WHT SKY 2014	R. STUART LOVE WHITE SKY 2014	R STUART & CO	750 ML	15.75	119452	PINNACLE IMPORTS	CS	12
851121006002	43 NOOOOOOOO	BURNT CITY BALLOON BOY FARMHOUSE WHEAT CANS	BURNT CITY BALLOON BOY FARMHOUSE WHEAT CANS	THE LUCKY STRIKE CORP DBA BURNT CTY	12 OZ		126840	PINNACLE IMPORTS	CS	24
851121006019	39 NOOOOOOOO	BURNT CITY FACEMELTER HIBISCUS IPA CANS	BURNT CITY FACEMELTER HIBISCUS IPA CANS	THE LUCKY STRIKE CORP DBA BURNT CTY	12 OZ		126850	PINNACLE IMPORTS	CS	24
851121006026	41 NOOOOOOOO	BURNT CITY DICK THE BUTCHER PALE ALE CANS	BURNT CITY DICK THE BUTCHER PALE ALE CANS	THE LUCKY STRIKE CORP DBA BURNT CTY	12 OZ		126860	PINNACLE IMPORTS	CS	24
851121006033	36 NOOOOOOOO	BURNT CITY RETROFIT LIME RADLER CANS	BURNT CITY RETROFIT LIME RADLER CANS	THE LUCKY STRIKE CORP DBA BURNT CTY	12 OZ		126861	PINNACLE IMPORTS	CS	24
851278005002	43 NOOOOOOOO	SONOMA CIDER THE HATCHET APPLE CIDER 6412OZ	SONOMA CIDER THE HATCHET APPLE CIDER 6/4/12OZ	UNITED STATES BEVERAGE LLC (SONOMA BEV WORKS)	12 OZ	1.94	124850	PINNACLE IMPORTS	CS	24
851278005057	43 NOOOOOOOO	SONOMA CIDER THE ANVIL BOURBON CIDER 6412OZ	SONOMA CIDER THE ANVIL BOURBON CIDER 6/4/12OZ	UNITED STATES BEVERAGE LLC (SONOMA BEV WORKS)	12 OZ	1.94	124852	PINNACLE IMPORTS	CS	24
851278005101	44 NOOOOOOOO	SONOMA CIDER THE PITCHFORK PEAR CIDER 6412OZ	SONOMA CIDER THE PITCHFORK PEAR CIDER 6/4/12OZ	UNITED STATES BEVERAGE LLC (SONOMA BEV WORKS)	12 OZ	1.94	124851	PINNACLE IMPORTS	CS	24
851278005286	45 NOOOOOOOO	SONOMA CIDER THE PULLEY ABSINTHE CIDER 6412OZ	SONOMA CIDER THE PULLEY ABSINTHE CIDER 6/4/12OZ	UNITED STATES BEVERAGE LLC (SONOMA BEV WORKS)	12 OZ	2.58	124856	PINNACLE IMPORTS	CS	24
851278005286	41 NOOOOOOOO	SONOMA CIDER THE WIMBLE RHUBARB GOSE CANS	SONOMA CIDER THE WIMBLE RHUBARB GOSE 4PK CANS	UNITED STATES BEVERAGE LLC (SONOMA BEV WORKS)	12 OZ	1.94	126970	PINNACLE IMPORTS	CS	24
851278005408	50 NOOOOOOOO	SONOMA CIDER THE WASHBOARD 6412OZ  2412OZ (124858)	SONOMA CIDER THE WASHBOARD 6/4/12OZ / 24/12OZ (124858)	UNITED STATES BEVERAGE LLC (SONOMA BEV WORKS)	12 OZ	1.94	124858	PINNACLE IMPORTS	CS	24
851278005569	y	SONOMA CIDER HATCHET CANS	SONOMA CIDER HATCHET CANS	UNITED STATES BEVERAGE LLC (SONOMA BEV WORKS)	12 OZ	1.94	1728	PINNACLE IMPORTS	CS	24
851278005583	y	SONOMA CIDER PITCHFORK CANS	SONOMA CIDER PITCHFORK CANS	UNITED STATES BEVERAGE LLC (SONOMA BEV WORKS)	12 OZ	1.94	1729	PINNACLE IMPORTS	CS	24
851514002567	y	CASCADE BREWING SANG ROYAL SOUR	CASCADE BREWING SANG ROYAL SOUR	CASCADE BREWING	24.5 OZ		126770	PINNACLE IMPORTS	CS	12
851514002598	y	CASCADE BREWING NOYAUX SOUR	CASCADE BREWING NOYAUX SOUR	CASCADE BREWING	24.5 OZ		126541	PINNACLE IMPORTS	CS	12
851514002604	y	CASCADE BREWING FIGARO SOUR	CASCADE BREWING FIGARO SOUR	CASCADE BREWING	24.5 OZ		126540	PINNACLE IMPORTS	CS	12
851514002635	y	CASCADE BREWING CRANBERRY SOUR	CASCADE BREWING CRANBERRY SOUR	CASCADE BREWING	24.5 OZ		126531	PINNACLE IMPORTS	CS	12
851514002642	y	CASCADE BREWING BLBERRY SOUR	CASCADE BREWING BLBERRY SOUR	CASCADE BREWING	24.5 OZ		126530	PINNACLE IMPORTS	CS	12
851514002659	y	CASCADE BREWING APRICOT SOUR	CASCADE BREWING APRICOT SOUR	CASCADE BREWING	24.5 OZ		126750	PINNACLE IMPORTS	CS	12
851514002666	y	CASCADE BREWING KRIEK	CASCADE BREWING KRIEK	CASCADE BREWING	24.5 OZ		126740	PINNACLE IMPORTS	CS	12
851514002697	y	CASCADE BREWING STRAWBERRY	CASCADE BREWING STRAWBERRY	CASCADE BREWING	24.5 OZ		126771	PINNACLE IMPORTS	CS	12
851514002703	33 NOOOOOOOO	CASCADE BREWING MANHATTAN NW SOUR	CASCADE BREWING MANHATTAN NW SOUR	CASCADE BREWING	24.5 OZ		126760	PINNACLE IMPORTS	CS	12
851573001013	54 NOOOOOOOO	FR BROAD RYE HOPPER RYE PALE ALE 16 BARREL 5.2 GALLONS	FRENCH BROAD RYE HOPPER RYE PALE ALE 1/6 BARREL 5.2 GALLONS	FRENCH BROAD BREWERY	5.16667GA L		303810	PINNACLE IMPORTS	EA	1
851573001013	36 NOOOOOOOO	CRISTOM SOMMERS RESERVE PN NOIR 2012	CRISTOM SOMMERS RESERVE PINOT NOIR 2012	CRISTOM	750 ML	38	11638012	PINNACLE IMPORTS	CS	12
851573001037	38 NOOOOOOOO	CRISTOM MARJORIE VINEYARD PN NOIR 2012	CRISTOM MARJORIE VINEYARD PINOT NOIR 2012	CRISTOM	750 ML	51.75	11525012	PINNACLE IMPORTS	CS	12
851573001099	36 NOOOOOOOO	CRISTOM EILEEN VINEYARD PN NOIR 2013	CRISTOM EILEEN VINEYARD PINOT NOIR 2013	CRISTOM	750 ML	52.5	11522013	PINNACLE IMPORTS	CS	12
851573001112	34 NOOOOOOOO	CRISTOM MT. JEFFERSON PN NOIR 2015	CRISTOM MT. JEFFERSON PINOT NOIR 2015	CRISTOM	750 ML	24.75	11637012	PINNACLE IMPORTS	CS	12
