UPC	length	RECEIPT ALIAS	ITEM NAME	BRAND	SIZE	COST	SUID	VENDOR	UOM	PACK
600519001125	y	HARVIESTOUN ENGINE OIL ENGINEERS	HARVIESTOUN OLD ENGINE OIL ENGINEERS RESERVE 12PK/11.2	B. UNITED	11.2 OZ		302250	PINNACLE IMPORTS	CS	12
603110200102	y	WILLAKENZIE EMERY PN NOIR 13	WILLAKENZIE EMERY PINOT NOIR 2013	JACKSON FAMILY ENTERPRISES	750 ML	42.75	105200	PINNACLE IMPORTS	CS	6
603110950038	y	WILLAKENZIE GISELE PN NOIR 15	WILLAKENZIE GISELE PINOT NOIR 2015	JACKSON FAMILY ENTERPRISES	750 ML	23.25	105191	PINNACLE IMPORTS	CS	12
603110970012	y	WILLAKENZIE PINOT GRIS 2016	WILLAKENZIE PINOT GRIS 2016	JACKSON FAMILY ENTERPRISES	750 ML	18.75	121580	PINNACLE IMPORTS	CS	12
606179201400	y	SANTHELENA REFOSCO IGT 2012	SANTHELENA REFOSCO IGT 2012	DOMAINE SELECT WINE ESTATE	750 ML	18.75	1607	PINNACLE IMPORTS	CS	12
606179202605	y	CH BERRES IMPULSE RIESLING 2013	CH BERRES IMPULSE RIESLING 2013	CLASSICAL WINES	750 ML	15	111092	PINNACLE IMPORTS	CS	12
606179203008	y	FANTINEL PINOT GRIGIO FRUILI 16	FANTINEL PINOT GRIGIO FRUILI DEL GRAVE DOC 2016	DOMAINE SELECT WINE ESTATE	750 ML	12	106441	PINNACLE IMPORTS	CS	12
606179203107	y	FANTINEL CAB SAUV 2015	FANTINEL CABERNET SAUVIGNON 2015	DOMAINE SELECT WINE ESTATE	750 ML	12	106442	PINNACLE IMPORTS	CS	12
606179204005	y	SANTHELENA PINOT GRIGIO DOC 2016	SANTHELENA PINOT GRIGIO DOC 2016	DOMAINE SELECT WINE ESTATE	750 ML	18.75	1608	PINNACLE IMPORTS	CS	12
606179204203	y	SANTHELENA FRIULANO DOC 2015	SANTHELENA FRIULANO DOC 2015	DOMAINE SELECT WINE ESTATE	750 ML	18.75	1611	PINNACLE IMPORTS	CS	12
606179204302	y	SANTHELENA RIBOLLA GIALLA IGT 15	SANTHELENA RIBOLLA GIALLA IGT 2015	DOMAINE SELECT WINE ESTATE	750 ML	18.75	1609	PINNACLE IMPORTS	CS	12
606179207808	y	BERRS URZIGER WURZGARTEN RIES 11	CH BERRES URZIGER WURZGARTEN RIESLING KAB 2011	CLASSICAL WINES	750 ML	18	111093	PINNACLE IMPORTS	CS	12
606179207808	y	FANTINEL ONE & ONLY BRUT ROSE	FANTINEL ONE & ONLY BRUT ROSE	DOMAINE SELECT WINE ESTATE	750 ML	14.25	106440	PINNACLE IMPORTS	CS	12
606179209451	y	FRONTIERE COLLIO BIANCO DOC 14	SANTHELENA FRONTIERE COLLIO BIANCO DOC 2014	DOMAINE SELECT WINE ESTATE	750 ML	27	1613	PINNACLE IMPORTS	CS	12
606179209468	y	VENKO COLLIO ROSSO DOC 2010	SANTHELENA VENKO COLLIO ROSSO DOC 2010	DOMAINE SELECT WINE ESTATE	750 ML	27	1612	PINNACLE IMPORTS	CS	12
610373581169	y	LA PEPIERE MUSCADET DE MAINE 15	DOM DE LA PEPIERE MUSCADET DE MAINE ET SEVRE SUR LIE 2015	LOUIS-DRESSNER	750 ML	13.5	112160	PINNACLE IMPORTS	CS	12
610373581459	y	BERNARD BAUDRY CHINON 2014	BERNARD BAUDRY CHINON 2014	LOUIS-DRESSNER	750 ML	16.5	125560	PINNACLE IMPORTS	CS	12
611482000152	y	QUINTA DO CRASTO TINTA RORIZ 13	QUINTA DO CRASTO TINTA RORIZ 2013	BROADBENT SELECTIONS	750 ML	57	1658	PINNACLE IMPORTS	CS	3
611482021003	y	FERREIRA TAWNY DUQUE DE BRAGANCA	FERREIRA 20 YEAR TAWNY DUQUE DE BRAGANCA	BROADBENT SELECTIONS	750 ML	45.75	105620	PINNACLE IMPORTS	CS	12
611482021003	y	QUINTA DO CRASTO LBV 2010	QUINTA DO CRASTO LBV 2010	BROADBENT SELECTIONS	750 ML	21	105430	PINNACLE IMPORTS	CS	12
611482022031	y	WARWICK ESTATE RESERVE RD 2002	WARWICK ESTATE RESERVE RD 2002	BROADBENT SELECTIONS	750 ML	23.25	111240	PINNACLE IMPORTS	CS	12
611482042114	y	WARWCK ESTATE PROF SAUV BLANC 12	WARWICK ESTATE PROF. BLK SAUV BLANC 2012	BROADBENT SELECTIONS	750 ML	17.25	111252	PINNACLE IMPORTS	CS	12
611482045009	y	CH. MUSAR CUVEE ROUGE 2013	CH. MUSAR CUVEE ROUGE 2013	BROADBENT SELECTIONS	750 ML	18	107950	PINNACLE IMPORTS	CS	12
611482060330	y	BROADBENT VINHO VERDE NV	BROADBENT VINHO VERDE NV	BROADBENT SELECTIONS	750 ML	9	108710	PINNACLE IMPORTS	CS	12
611482070315	y	CLOS BRUSQUIERES CDP 2013	CLOS BRUSQUIERES CDP 2013	WINES OF FRANCE	375 ML		121793	PINNACLE IMPORTS	CS	24
611482070315	y	BROADBENT VINHO VERDE ROSE NV	BROADBENT VINHO VERDE ROSE NV	BROADBENT SELECTIONS	750 ML	9	108711	PINNACLE IMPORTS	CS	12
611482081601	y	WARWICK ESTATE PINOTAGE 2014	WARWICK ESTATE PINOTAGE 2014	BROADBENT SELECTIONS	750 ML	17.25	111251	PINNACLE IMPORTS	CS	12
611482961057	y	FERREIRA RUBY PORT NV	FERREIRA RUBY PORT NV	BROADBENT SELECTIONS	750 ML	13.5	105710	PINNACLE IMPORTS	CS	12
611482961064	y	FERREIRA TAWNY PORT NV	FERREIRA TAWNY PORT NV	BROADBENT SELECTIONS	750 ML	15	105720	PINNACLE IMPORTS	CS	12
611482961125	y	FERREIRA DONA ANTONIA RESRVE PRT	FERREIRA DONA ANTONIA RESERVE PORT NV	BROADBENT SELECTIONS	750 ML	16.5	105700	PINNACLE IMPORTS	CS	12
611482961811	y	CASA FERREIRINHA VINHA GRANDE 14	CASA FERREIRINHA VINHA GRANDE RD 2014	BROADBENT SELECTIONS	750 ML	16.5	1649	PINNACLE IMPORTS	CS	12
611482970202	y	QUINTA DO CRASTO DOURO RD 2015	QUINTA DO CRASTO DOURO RD 2015	BROADBENT SELECTIONS	750 ML	15.75	108702	PINNACLE IMPORTS	CS	12
620670307898	y	BIRRIFICIO DUCATO VERDI IMPERIAL	BIRRIFICIO DUCATO VERDI IMPERIAL STOUT 16PK/11.2OZ *	B. UNITED	11.2 OZ		302000	PINNACLE IMPORTS	CS	16
633560110980	y	LAETITIA ESTATE CHARD 2016	LAETITIA ESTATE CHARD 2016	LAETITIA VINEYARD & WINERY	750 ML	15	101915	PINNACLE IMPORTS	CS	12
633560130988	y	LAETITIA ESTATE PN NOIR 2016	LAETITIA ESTATE PINOT NOIR 2016	LAETITIA VINEYARD & WINERY	750 ML	23.25	101916	PINNACLE IMPORTS	CS	12
633560131985	y	LAETITIA RESERVE PN NOIR 2015	LAETITIA RESERVE PINOT NOIR 2015	LAETITIA VINEYARD & WINERY	750 ML	33	101914	PINNACLE IMPORTS	CS	6
633560201985	y	BENMARCO EXPRESIVO 2013	BENMARCO EXPRESIVO 2013	FOLIO WINE COMPANY LLC	750 ML	27.75	109341	PINNACLE IMPORTS	CS	12
636595512750	y	ULYSSES NAPA VALLEY CAB SAUV 12	ULYSSES NAPA VALLEY CABERNET SAUVIGNON 2012	DREYFUS - ASHBY	750 ML	145	126490	PINNACLE IMPORTS	CS	6
636659010734	y	E DUPONT BOUCHE BRUT CIDER	E. DUPONT BOUCHE BRUT CIDER 24/375ML	B. UNITED	375 ML	7	300310	PINNACLE IMPORTS	CS	24
637411000604	y	GIESEN MARLB EST SAUV BLANC 16	GIESEN MARLB ESTATE SAUV BLANC 2016	PACIFIC HIGHWAY WINE & SPIRITS	750 ML	10.5	107970	PINNACLE IMPORTS	CS	12
637789336749	y	BURGANS ALBARINO 2015	BURGANS ALBARINO 2015	EC-EUROPEAN CELLARS/ERIC SOLOMON	750 ML	12.75	120940	PINNACLE IMPORTS	CS	12
642917000058	y	DOM SERENE EVENSTD PN NOIR 13	DOMAINE SERENE EVENSTAD PINOT NOIR 2013 375ML	DOMAINE SERENE	375 ML	29.25	12219011	PINNACLE IMPORTS	CS	12
650826000021	y	BURNT CITY BUTCHER PALE KEG	BURNT CITY DICK THE BUTCHER PALE KEG	THE LUCKY STRIKE CORP DBA BURNT CTY	5.16667GA L		126890	PINNACLE IMPORTS	EA	1
650826000021	y	TORII MOR PINOT GRIS 2016	TORII MOR PINOT GRIS 2016	TORII MOR	750 ML	15.75	10515014	PINNACLE IMPORTS	CS	12
650826000038	y	BURNT CITY BALLOON BOY WHEAT KEG	BURNT CITY BALLOON BOY WHEAT KEG	THE LUCKY STRIKE CORP DBA BURNT CTY	5.16667GA L		126880	PINNACLE IMPORTS	EA	1
650826000120	y	FLORA SPRINGS CAB 2014	FLORA SPRINGS CAB 2014	FLORA SPRINGS WINERY & VINEYARDS	750 ML	33.75	123170	PINNACLE IMPORTS	CS	12
650826000120	y	TORII MOR DEUX VERRES PINOIR 11	TORII MOR DEUX VERRES PINOT NOIR 2011	TORII MOR	750 ML	30.75	115570	PINNACLE IMPORTS	CS	12
650826001189	y	TORII MOR OLSON ESTATE PINOIR 12	TORII MOR OLSON ESTATE PINOT NOIR 2012	TORII MOR	750 ML	48	115571	PINNACLE IMPORTS	CS	12
650826867457	y	TORII MOR BLK LABEL PINOIR 15	TORII MOR BLK LABEL PINOT NOIR 2015	TORII MOR	750 ML	20	105110	PINNACLE IMPORTS	CS	12
653149120018	y	CDR CRK DANKOSAURUS IPA KEG	CEDAR CREEK DANKOSAURUS IPA KEG	CEDAR CREEK BREWERY	5.16667GA L		126451	PINNACLE IMPORTS	EA	1
653149120018	y	FANTINI MONTEPULCIANO 2016	FANTINI MONTEPULCIANO 2016	EMPSON USA INC	750 ML	10.5	106250	PINNACLE IMPORTS	CS	12
653149220015	y	FANTINI TREBBIANO 2014	FANTINI TREBBIANO 2014	EMPSON USA INC	750 ML	11.25	106270	PINNACLE IMPORTS	CS	12
653149231110	y	FANTINI SANGIOVESE 2016	FANTINI SANGIOVESE 2016	EMPSON USA INC	750 ML	11.25	106260	PINNACLE IMPORTS	CS	12
653341883391	y	KNEE DEEP BREAKING BUD CANS	KNEE DEEP BREAKING BUD CANS 4PK	KNEE DEEP BREWING CO.	16 OZ		1434	PINNACLE IMPORTS	CS	24
653341883995	y	KNEE DEEP STOUTELLA CHOC STOUT	KNEE DEEP STOUTELLA CHOCOLATE STOUT CANS 4PK	KNEE DEEP BREWING CO.	16 OZ		1441	PINNACLE IMPORTS	CS	24
654029000819	y	BLANC BRUT SPARKLING CREM NV	MONTMARTE BLANC DE BLANC BRUT SPARKLING CREMANT NV	CANNON WINES	750 ML	10.5	111830	PINNACLE IMPORTS	CS	12
654029000826	y	MONTMARTE ROSE SPRKLNG CREMNT NV	MONTMARTE ROSE SEC SPARKLING CREMANT NV	CANNON WINES	750 ML	10.5	111840	PINNACLE IMPORTS	CS	12
654367783511	y	NOLLEN ERBEN RIESLNG SPATLESE 16	NOLLEN ERBEN RIESLING SPATLESE 2016	SOUTHEAST WINE PARTNERS LLC	750 ML	9.75	127400	PINNACLE IMPORTS	CS	12
654367783528	y	NOLLEN ERBEN DORNFELDER 2014	NOLLEN ERBEN DORNFELDER 2014	SOUTHEAST WINE PARTNERS LLC	750 ML	9.75	127412	PINNACLE IMPORTS	CS	12
654367783535	y	NOLLEN ERBEN NOT ROOST RIES 12	NOLLEN ERBEN NOTORIOUS ROOSTER RIESLING 2012	SOUTHEAST WINE PARTNERS LLC	750 ML	9.75	127413	PINNACLE IMPORTS	CS	12
654367783542	y	NOLLEN ERBEN RIESL KABINETT 15	NOLLEN ERBEN RIESLING KABINETT 2015	SOUTHEAST WINE PARTNERS LLC	750 ML	9.75	127410	PINNACLE IMPORTS	CS	12
654367783573	y	NOLLEN ERBEN RIESL AUSLESE 2015	NOLLEN ERBEN RIESLING AUSLESE 2015	SOUTHEAST WINE PARTNERS LLC	750 ML	9.75	127411	PINNACLE IMPORTS	CS	12
656218001133	y	DOCKSIDE PILSNER 4X 12OZ	THOMAS CREEK DOCKSIDE PILSNER 4X6PK 12OZ	THOMAS CREEK BREWERY	12 OZ		301100	PINNACLE IMPORTS	CS	24
656218204978	y	DEEP WATER DOPPLEBOCK 4X 12OZ	THOMAS CREEK DEEP WATER DOPPLEBOCK 4X6PK 12OZ	THOMAS CREEK BREWERY	12 OZ		301090	PINNACLE IMPORTS	CS	24
656218205685	y	DEEP WATER DOPPLEBOCK 5.2GAL	THOMAS CREEK DEEP WATER DOPPLEBOCK 1/6BBL 5.2GAL	THOMAS CREEK BREWERY	5.16667GA L		304340	PINNACLE IMPORTS	EA	1
656218237884	y	REVERDY SANCERRE ROSE 2016	REVERDY SANCERRE ROSE 2016	WEYGANDT-METZLER IMPORTING	750 ML	18	11917013	PINNACLE IMPORTS	CS	12
656218273356	y	UP THE CRK EXTREME IPA 6X 12OZ	THOMAS CREEK UP THE CREEK EXTREME IPA 6X4PK 12OZ	THOMAS CREEK BREWERY	12 OZ		301150	PINNACLE IMPORTS	CS	24
656218514152	y	BANANA SPLIT 12OZ	THOMAS CREEK BANANA SPLIT 12OZ 4PK	THOMAS CREEK BREWERY	12 OZ		304331	PINNACLE IMPORTS	CS	24
656218764205	y	TRIFECTA IPA CANS	THOMAS CREEK TRIFECTA IPA CANS	THOMAS CREEK BREWERY	12 OZ		1534	PINNACLE IMPORTS	CS	24
656218812364	y	APPALACHIAN AMBER ALE 4X 12OZ	THOMAS CREEK APPALACHIAN AMBER ALE 4X6PK 12OZ	THOMAS CREEK BREWERY	12 OZ		301070	PINNACLE IMPORTS	CS	24
656218819974	y	COFFEE OATMEAL STOUT 4	THOMAS CREEK COFFEE OATMEAL STOUT 4/6PK	THOMAS CREEK BREWERY	12 OZ		121840	PINNACLE IMPORTS	CS	24
656218969525	y	STILLWATER VAN CREAM ALE 12OZ	THOMAS CREEK STILLWATER VANILLA CREAM ALE 4X6PK 12OZ	THOMAS CREEK BREWERY	12 OZ		301140	PINNACLE IMPORTS	CS	24
656218969525	y	SPY VALLEY ENVOY PN NOIR 2011	SPY VALLEY ENVOY PINOT NOIR 2011 6PK	BROADBENT SELECTIONS	750 ML	39	10800011	PINNACLE IMPORTS	CS	6
656218986355	y	CLASS FIVE IPA 4X 12OZ	THOMAS CREEK CLASS FIVE IPA 4X6PK 12OZ	THOMAS CREEK BREWERY	12 OZ		301080	PINNACLE IMPORTS	CS	24
656218993728	y	TRIFECTA IPA 4 12OZ	THOMAS CREEK TRIFECTA IPA 4/6PK 12OZ	THOMAS CREEK BREWERY	12 OZ		121841	PINNACLE IMPORTS	CS	24
663194000142	y	DE DOLLE SPEC EXPORT STOUT11.2	DE DOLLE SPECIAL EXPORT STOUT 20PK/11.2	B. UNITED	11.2 OZ		301460	PINNACLE IMPORTS	CS	20
666056000090	y	VELENOSI ROSSO PICENO BRECC 14	VELENOSI ROSSO PICENO BRECCIAROLO 2014	DOMAINE SELECT WINE ESTATE	750 ML	14.25	127423	PINNACLE IMPORTS	CS	12
666056000199	y	QUATTRO MANI MONTEPULCIANO 2016	QUATTRO MANI MONTEPULCIANO 2016	DOMAINE SELECT WINE ESTATE	750 ML	11.25	106360	PINNACLE IMPORTS	CS	12
666056000205	y	VELENOSI VERDICCIO 2015	VELENOSI VERDICCIO 2015	DOMAINE SELECT WINE ESTATE	750 ML	14.25	127420	PINNACLE IMPORTS	CS	12
666056000236	y	VELENOSI LACRIMA DI MORRO 2015	VELENOSI LACRIMA DI MORRO 2015	DOMAINE SELECT WINE ESTATE	750 ML	14.25	127422	PINNACLE IMPORTS	CS	12
666056000359	y	VELENOSI PECORINO 2016	VELENOSI PECORINO 2016	DOMAINE SELECT WINE ESTATE	750 ML	14.25	127421	PINNACLE IMPORTS	CS	12
670580002178	y	BERGSTROM OLD STONE CHRDNY 2014	BERGSTROM OLD STONE CHRDNY 2014	BERGSTROM	750 ML	21	104453	PINNACLE IMPORTS	CS	12
670580009177	y	BERGSTROM SIGRID CHRDNY 10	BERGSTROM SIGRID CHRDNY 2010 6PACK	BERGSTROM	750 ML	64	104450	PINNACLE IMPORTS	CS	6
670580100171	y	BERGSTROM SILICE PN NOIR 2015	BERGSTROM SILICE PINOT NOIR 2015 6PK	BERGSTROM	750 ML	52.5	11521114	PINNACLE IMPORTS	CS	6
675829502013	y	FORMATION CHRDNY 2013	FORMATION CHRDNY 2013	VINO DEL SOL	750 ML	12.75	101470	PINNACLE IMPORTS	CS	12
675829502068	y	FORMATION PN NOIR 2014	FORMATION PINOT NOIR 2014	VINO DEL SOL	750 ML	12.75	101490	PINNACLE IMPORTS	CS	12
676814000231	y	PORTAZ VIN DE SAVOIE APREMONT 15	DOM PORTAZ VIN DE SAVOIE APREMONT 2015	NORTH BERKELEY IMPORTS	750 ML	14.25	126690	PINNACLE IMPORTS	CS	12
677925000141	y	GERTRUDE TOSCANA ROSSO 14	LA MAIALINA GERTRUDE TOSCANA ROSSO 2014	DOMAINE SELECT WINE ESTATE	750 ML	12	107201	PINNACLE IMPORTS	CS	12
677925000387	y	GILFRDO TOSCANA BIANCO 2014	LA MAIALINA GILFRDO TOSCANA BIANCO 2014	DOMAINE SELECT WINE ESTATE	750 ML	12	107202	PINNACLE IMPORTS	CS	12
683318626218	y	FITVINE CAB 2015	FITVINE CABERNET 2015	MHW LTD/ FIT VINE LLC	750 ML	12.75	1968	PINNACLE IMPORTS	CS	12
683318626225	y	FITVINE CHRDNY 2016	FITVINE CHRDNY 2016	MHW LTD/ FIT VINE LLC	750 ML	12.75	1966	PINNACLE IMPORTS	CS	12
683318626232	y	FITVINE PN NOIR 2016	FITVINE PINOT NOIR 2016	MHW LTD/ FIT VINE LLC	750 ML	15.75	1967	PINNACLE IMPORTS	CS	12
683318626249	y	FITVINE SAUV BLANC 2016	FITVINE SAUV BLANC 2016	MHW LTD/ FIT VINE LLC	750 ML	12.75	1969	PINNACLE IMPORTS	CS	12
683318626263	y	FITVINE PINOT GRIGIO 2016	FITVINE PINOT GRIGIO 2016	MHW LTD/ FIT VINE LLC	750 ML	12.75	1970	PINNACLE IMPORTS	CS	12
683318988248	y	PHANTASMAGORIA DIPA CANS	PRAIRIE PHANTASMAGORIA DIPA CANS	KREBS BREWING CO (PRAIRIE)	12 OZ		1685	PINNACLE IMPORTS	CS	24
683318988255	y	VOUS FR BRETT COND SAISON BOT	PRAIRIE VOUS FRANCAIS BRETT CONDITIONED SAISON BOTTLE	KREBS BREWING CO (PRAIRIE)	24.5 OZ		1687	PINNACLE IMPORTS	CS	12
683318988309	y	4TH ANN ALE SOUR AGED GINGER	PRAIRIE 4TH ANNIVERSARY ALE (SOUR AGED ON GINGER) (LR)	KREBS BREWING CO (PRAIRIE)	16.9 OZ		1691	PINNACLE IMPORTS	CS	12
683318988323	y	STOUT W TOASTED COCO & VAN	PRAIRIE PARADISE STOUT W/ TOASTED COCONUT & VANILLA BOTTLES	KREBS BREWING CO (PRAIRIE)	12 OZ		1681	PINNACLE IMPORTS	CS	12
683318988415	y	PRISON RODEO HOPPY COFFEE ALE	PRAIRIE PRISON RODEO HOPPY COFFEE ALE (LR)	KREBS BREWING CO (PRAIRIE)	12 OZ		1709	PINNACLE IMPORTS	CS	24
683318988422	y	TWIST DRY HOPPED SOUR CANS	PRAIRIE TWIST DRY HOPPED SOUR CANS	KREBS BREWING CO (PRAIRIE)	12 OZ		1707	PINNACLE IMPORTS	CS	24
683318988439	y	VAPE TRICKS SOUR CHERRY CANS	PRAIRIE VAPE TRICKS SOUR CHERRY CANS (LR)	KREBS BREWING CO (PRAIRIE)	12 OZ		1743	PINNACLE IMPORTS	CS	24
689076060997	y	HOPPIN FROG MEAN MANALISHI 2 IPA	HOPPIN FROG MEAN MANALISHI DOUBLE IPA	HOPPIN FROG BREWERY	22 OZ		123150	PINNACLE IMPORTS	CS	12
689076200293	y	CDR LE BOUQUET DES GARRIGUES 12	CAILLOU CDR LE BOUQUET DES GARRIGUES 2012	NORTH BERKELEY IMPORTS	750 ML	22.5	11132012	PINNACLE IMPORTS	CS	12
689076200293	y	CAILLOU COTES CDR CUVEE UNIQ 14	CAILLOU COTES CDR VV CUVEE UNIQUE 2014	NORTH BERKELEY IMPORTS	750 ML	22.5	11132011	PINNACLE IMPORTS	CS	12
689076839341	y	HOPPIN FROG GOOSE JUICE RYE IPA	HOPPIN FROG GOOSE JUICE RYE IPA	HOPPIN FROG BREWERY	22 OZ		123141	PINNACLE IMPORTS	CS	12
689076839341	y	HOPPIN FROG HOPPIN TO HEAVEN IPA	HOPPIN FROG HOPPIN TO HEAVEN IPA	HOPPIN FROG BREWERY	22 OZ		123140	PINNACLE IMPORTS	CS	12
689076839549	y	HOPPIN FROG BORIS OAT IMP STOUT	HOPPIN FROG BORIS CRUSHER OATMEAL IMPERIAL STOUT	HOPPIN FROG BREWERY	22 OZ		120330	PINNACLE IMPORTS	CS	12
689192040270	y	DOM SER EVENSTAD RES PN NOIR 13	DOMAINE SERENE EVENSTAD RESERVE PINOT NOIR 2013	DOMAINE SERENE	750 ML	59.25	11527013	PINNACLE IMPORTS	CS	12
689192050170	y	DOMAINE SERENE ROSE	DOMAINE SERENE ROSE	DOMAINE SERENE	750 ML	24.75	104600	PINNACLE IMPORTS	CS	12
689192370278	y	DOM SER EVENSTAD RES PN NOIR 14	DOMAINE SERENE EVENSTAD RESERVE PINOT NOIR 2014	DOMAINE SERENE	750 ML	59.25	1757	PINNACLE IMPORTS	CS	6
689192371374	y	DOM SER JERUSALEM HILL PN 2013	DOMAINE SERENE JERUSALEM HILL PN 2013	DOMAINE SERENE	750 ML	77	127390	PINNACLE IMPORTS	CS	12
689192372876	y	DOM SER RECOLTE CHRDNY 2013	DOMAINE SERENE RECOLTE CHRDNY 2013	DOMAINE SERENE	750 ML	79	127370	PINNACLE IMPORTS	CS	6
690604000393	y	GASSIER NOSTRE PAIS RD 2013	GASSIER NOSTRE PAIS RD 2013	EC-EUROPEAN CELLARS/ERIC SOLOMON	750 ML	15.75	120571	PINNACLE IMPORTS	CS	12
690604000485	y	GASSIER NOSTRE PAIS WHT 2013	GASSIER NOSTRE PAIS WHITE 2013	EC-EUROPEAN CELLARS/ERIC SOLOMON	750 ML	15.75	120572	PINNACLE IMPORTS	CS	12
690604000492	y	WILLAKENZIE ALIETTE PN NOIR 2013	WILLAKENZIE ALIETTE PINOT NOIR 2013	JACKSON FAMILY ENTERPRISES	750 ML	42.75	105215	PINNACLE IMPORTS	CS	6
690604000492	y	GASSIER CERCIUS VV ROUGE 2014	GASSIER CERCIUS VV ROUGE 2014	EC-EUROPEAN CELLARS/ERIC SOLOMON	750 ML	12.75	120575	PINNACLE IMPORTS	CS	12
690604000508	y	GASSIER CERCIUS BLANC 2015	GASSIER CERCIUS BLANC 2015	EC-EUROPEAN CELLARS/ERIC SOLOMON	750 ML	11.25	126270	PINNACLE IMPORTS	CS	12
696859065750	y	FR BROAD GATEWAY KOLSCH 4 CANS	FRENCH BROAD GATEWAY KOLSCH 4/6PK CANS	FRENCH BROAD BREWERY	12 OZ		123500	PINNACLE IMPORTS	CS	24
696859065767	y	FR BROAD WEE HEAVY-ER 4 CANS	FRENCH BROAD WEE HEAVY-ER 4/6PK CANS	FRENCH BROAD BREWERY	12 OZ		123490	PINNACLE IMPORTS	CS	24
696859065767	y	MARCARINI ROERO ARNEIS DOC 2014	MARCARINI ROERO ARNEIS DOC 2014	EMPSON USA INC	750 ML	18	119141	PINNACLE IMPORTS	CS	12
699176203317	54 NOOOOOOOO	BROUWERIJ VERHAEGHE DUCHESSE DE BOURGOGNE FLEMISH RD 6	BROUWERIJ VERHAEGHE DUCHESSE DE BOURGOGNE FLEMISH RD 6/4PK	D & V INTERNATIONAL	11.2 OZ		301560	PINNACLE IMPORTS	CS	24
699176257518	y	ST BERNARDUS TRIPEL 1225.4OZ	ST BERNARDUS TRIPEL 12/25.4OZ	D & V INTERNATIONAL	24.5 OZ		302640	PINNACLE IMPORTS	CS	12
699176267517	y	ST BERNARDUS PRIOR 8 1225.4OZ	ST BERNARDUS PRIOR 8 12/25.4OZ	D & V INTERNATIONAL	24.5 OZ		302630	PINNACLE IMPORTS	CS	12
699176513317	y	ST BERNARDUS CHRISTMAS ALE 6	ST BERNARDUS CHRISTMAS ALE 6/4PK	D & V INTERNATIONAL	11.2 OZ		121210	PINNACLE IMPORTS	CS	24
699176513317	y	ST BERNARDUS PRIOR 8 611.2OZ	ST BERNARDUS PRIOR 8 6/4PK/11.2OZ	D & V INTERNATIONAL	11.2 OZ		117630	PINNACLE IMPORTS	CS	24
699176523316	y	ST BERNARDUS ABT 12 611.2OZ	ST BERNARDUS ABT 12 6/4PK/11.2OZ	D & V INTERNATIONAL	11.2 OZ		117610	PINNACLE IMPORTS	CS	24
699176533315	y	SPY VALLEY RIESLING 2012	SPY VALLEY RIESLING 2012	BROADBENT SELECTIONS	750 ML	15.75	108021	PINNACLE IMPORTS	CS	12
699176587516	47 NOOOOOOOO	BROUWERIJ VERHAEGHE ECHT KRIEKENBIER 6 11.2OZ *	BROUWERIJ VERHAEGHE ECHT KRIEKENBIER 6/4PK 11.2OZ *	D & V INTERNATIONAL	11.2 OZ		301480	PINNACLE IMPORTS	CS	24
699176613345	34 NOOOOOOOO	BRASSERIE DE ROCS BRUNE 6 11.2OZ *	BRASSERIE DE ROCS BRUNE 6/4PK 11.2OZ *	D & V INTERNATIONAL	11.2 OZ		301530	PINNACLE IMPORTS	CS	24
699176633343	y	ST BERNARDUS WIT 1225.4OZ	ST BERNARDUS WIT 12/25.4OZ	D & V INTERNATIONAL	24.5 OZ		302660	PINNACLE IMPORTS	CS	12
699176913346	54 NOOOOOOOO	ST BERNARDUS GIFT PACK WGLASS - ABT PATER PRIOR & TRIP	ST BERNARDUS GIFT PACK W/GLASS - ABT PATER PRIOR & TRIP	D & V INTERNATIONAL	11.2 OZ		301240	PINNACLE IMPORTS	CS	24
702631024263	y	TERRABIANCA CAMPACCIO 2013	TERRABIANCA CAMPACCIO 2013	EMPSON USA INC	750 ML	27.75	10730009	PINNACLE IMPORTS	CS	12
705105469317	36 NOOOOOOOO	BEAVERTOWN QUELLE ENGLISH SAISON 20L	BEAVERTOWN QUELLE ENGLISH SAISON 20L	B. UNITED	20 L		125263	PINNACLE IMPORTS	EA	1
705105608662	y	HORSE & PLOW FARMSTEAD RD 2015	HORSE & PLOW FARMSTEAD RD 2015	HORSE & PLOW	750 ML	14.75	10169012	PINNACLE IMPORTS	CS	12
705105631332	y	LUTEA LOS CARNEROS PN NOIR 2010	LUTEA LOS CARNEROS PINOT NOIR 2010	LUTEA	750 ML	14.75	101920	PINNACLE IMPORTS	CS	12
705105777443	y	FR BROAD IPA 12  22 OUNCE	FRENCH BROAD IPA 12 / 22 OUNCE	FRENCH BROAD BREWERY	22 OZ		302480	PINNACLE IMPORTS	CS	12
715962081119	y	FROGS LEAP SAUV BLANC 2016	FROGS LEAP SAUVIGNON BLANC 2016	FROGS LEAP	750 ML	18.75	10144013	PINNACLE IMPORTS	CS	12
715962081157	y	FROGS LEAP ZINFANDEL 2015	FROGS LEAP ZINFANDEL 2015	FROGS LEAP	750 ML	24.75	10143012	PINNACLE IMPORTS	CS	12
715962082130	y	FROGS LEAP ESTATE CAB SAUV 2015	FROGS LEAP ESTATE CABERNET SAUVIGNON 2015	FROGS LEAP	750 ML	39.5	101391	PINNACLE IMPORTS	CS	12
715962082185	y	FROGS LEAP CHRDNY 2016	FROGS LEAP CHRDNY 2016	FROGS LEAP	750 ML	25.5	11600012	PINNACLE IMPORTS	CS	12
716819005265	34 NOOOOOOOO	ENRIQUE FOSTER MALBEC RESERVE 2009	ENRIQUE FOSTER MALBEC RESERVE 2009	DREYFUS - ASHBY	750 ML	19.5	109001	PINNACLE IMPORTS	CS	12
716819005289	40 NOOOOOOOO	CRIOS DE SUSANA BALBO SYRAH-BONARDA 2011	CRIOS DE SUSANA BALBO SYRAH-BONARDA 2011	FOLIO WINE COMPANY LLC	750 ML	12.75	108920	PINNACLE IMPORTS	CS	12
717208272404	y	BISHOPS PEAK CHRDNY 2016	BISHOPS PEAK CHRDNY 2016	TALLEY VINEYARDS	750 ML	14.25	103780	PINNACLE IMPORTS	CS	12
717208272404	34 NOOOOOOOO	BOSQ. DES PAPES CHANTELEMERLE 2013	BOSQ. DES PAPES CHANTELEMERLE 2013	WINES OF FRANCE	750 ML	61.5	121753	PINNACLE IMPORTS	CS	12
717208272732	36 NOOOOOOOO	BISHOPS PEAK ELEVATION RD BLEND 2014	BISHOPS PEAK ELEVATION RD BLEND 2014	TALLEY VINEYARDS	750 ML	20.25	103765	PINNACLE IMPORTS	CS	12
717208277607	y	BISHOPS PEAK PN NOIR 2014	BISHOPS PEAK PINOT NOIR 2014	TALLEY VINEYARDS	750 ML	18	115130	PINNACLE IMPORTS	CS	12
717208277607	y	BISHOPS PEAK REISLING 2014	BISHOPS PEAK REISLING 2014	TALLEY VINEYARDS	750 ML	14.25	103790	PINNACLE IMPORTS	CS	12
717208277607	y	BOSQ. DES PAPES GLOIRDEMON 2012	BOSQ. DES PAPES GLOIRDEMON 2012	WINES OF FRANCE	750 ML	51	121751	PINNACLE IMPORTS	CS	12
717208883242	y	TALLEY ARROYO CHARD 2014	TALLEY ARROYO CHARD 2014	TALLEY VINEYARDS	750 ML	21	10380012	PINNACLE IMPORTS	CS	12
717208896243	y	TALLEY CHARD OLIVERS 2014	TALLEY CHARD OLIVERS 2014	TALLEY VINEYARDS	750 ML	27.75	10381013	PINNACLE IMPORTS	CS	6
717208896243	y	TALLEY OLIVERS CHRDNY 2012	TALLEY OLIVERS CHRDNY 6PK 2012	TALLEY VINEYARDS	750 ML	27	10381012	PINNACLE IMPORTS	CS	6
721354200310	40 NOOOOOOOO	LECOLE NO. 41 COLUMBIA VALLEY SYRAH 2012	LECOLE NO. 41 COLUMBIA VALLEY SYRAH 2012	LECOLE NO. 41	750 ML	20.25	10527011	PINNACLE IMPORTS	CS	12
721354201225	37 NOOOOOOOO	LECOLE NO. 41 WALLA WALLA MERLOT 2012	LECOLE NO. 41 WALLA WALLA MERLOT 2012	LECOLE NO. 41	750 ML	30	105254	PINNACLE IMPORTS	CS	12
721354850034	y	LECOLE NO. 41 FRTOWN RD 2014	LECOLE NO. 41 FRENCHTOWN RD 2014	LECOLE NO. 41	750 ML	18.75	105261	PINNACLE IMPORTS	CS	12
721354880017	41 NOOOOOOOO	LECOLE NO. 41 COLUMBIA VALLEY CHRDNY 2015	LECOLE NO. 41 COLUMBIA VALLEY CHRDNY 2015	LECOLE NO. 41	750 ML	18	105260	PINNACLE IMPORTS	CS	12
721354890023	47 NOOOOOOOO	LECOLE NO. 41 COLUMBIA VALLEY CHENIN BLANC 2014	LECOLE NO. 41 COLUMBIA VALLEY CHENIN BLANC 2014	LECOLE NO. 41	750 ML	13.5	105272	PINNACLE IMPORTS	CS	12
721354890023	43 NOOOOOOOO	LECOLE NO. 41 COLUMBIA VALLEY SEMILLON 2014	LECOLE NO. 41 COLUMBIA VALLEY SEMILLON 2014	LECOLE NO. 41	750 ML	12.75	105271	PINNACLE IMPORTS	CS	12
721354890030	y	WOSTYNTJE MUSTARD ALE  2411.2OZ	WOSTYNTJE MUSTARD ALE / 24/11.2OZ	B. UNITED	11.2 OZ		117801	PINNACLE IMPORTS	CS	24
721354890030	41 NOOOOOOOO	LECOLE NO. 41 COLUMBIA VALLEY MERLOT 2013	LECOLE NO. 41 COLUMBIA VALLEY MERLOT 2013	LECOLE NO. 41	750 ML	21	12170011	PINNACLE IMPORTS	CS	12
721354890047	36 NOOOOOOOO	LECOLE NO. 41 COLUMBIA CAB SAUV 2014	LECOLE NO. 41 COLUMBIA CAB SAUV 2014	LECOLE NO. 41	750 ML	25.5	105250	PINNACLE IMPORTS	CS	12
721354970015	39 NOOOOOOOO	LECOLE NO. 41 WALLA WALLA CAB SAUV 2012	LECOLE NO. 41 WALLA WALLA CABERNET SAUVIGNON 2012	LECOLE NO. 41	750 ML	33	105251	PINNACLE IMPORTS	CS	12
721512000622	y	FREY NATURAL WHT	JGS-FREY NATURAL WHITE	JOHNNY GREEN SEEDS	750 ML	10.5	126089	PINNACLE IMPORTS	CS	12
721512000653	y	FREY ORG ZIN 14	JGS-FREY ORG ZIN 14	JOHNNY GREEN SEEDS	750 ML	14.25	126086	PINNACLE IMPORTS	CS	12
721512000691	y	FREY NATURAL RD	JGS-FREY NATURAL RD	JOHNNY GREEN SEEDS	750 ML	11.25	126088	PINNACLE IMPORTS	CS	12
721512000721	y	FREY ORG CHARD 16	JGS-FREY ORG CHARD 16	JOHNNY GREEN SEEDS	750 ML	14.25	126087	PINNACLE IMPORTS	CS	12
721512000745	y	FREY ORG CAB 16	JGS-FREY ORG CAB 16	JOHNNY GREEN SEEDS	750 ML	15	126079	PINNACLE IMPORTS	CS	12
721512000752	y	FREY ORG PN NOIR 15	JGS-FREY ORG PINOT NOIR 15	JOHNNY GREEN SEEDS	750 ML	16.5	126085	PINNACLE IMPORTS	CS	12
721512000776	y	FREY BIODYNAMIC CAB 14	JGS-FREY BIODYNAMIC CAB 14	JOHNNY GREEN SEEDS	750 ML	16.5	126082	PINNACLE IMPORTS	CS	12
721512000776	33 NOOOOOOOO	PIBARNON BANDOL NUANCES ROSE 2014	PIBARNON BANDOL NUANCES ROSE 2014	NORTH BERKELEY IMPORTS	750 ML	45	111805	PINNACLE IMPORTS	CS	12
721512000806	y	FREY BIODYNAMIC ZIN 15	JGS-FREY BIODYNAMIC ZIN 15	JOHNNY GREEN SEEDS	750 ML	16.5	126083	PINNACLE IMPORTS	CS	12
721512005016	y	PACIFIC RDWOOD CAB 16	JGS-PACIFIC RDWOOD CAB 16	JOHNNY GREEN SEEDS	750 ML	11.25	126140	PINNACLE IMPORTS	CS	12
721512005023	y	PACIFIC RDWOOD MERLOT 15	JGS-PACIFIC RDWOOD MERLOT 15	JOHNNY GREEN SEEDS	750 ML	11.25	126142	PINNACLE IMPORTS	CS	12
721512005030	y	PACIFIC RDWOOD PN NOIR 16	JGS-PACIFIC RDWOOD PINOT NOIR 16	JOHNNY GREEN SEEDS	750 ML	15	126143	PINNACLE IMPORTS	CS	12
721512005047	y	PACIFIC RDWOOD RD NV	JGS-PACIFIC RDWOOD RD NV	JOHNNY GREEN SEEDS	750 ML	9	126144	PINNACLE IMPORTS	CS	12
721512005054	y	PACIFIC RDWOOD SYRAH 15	JGS-PACIFIC RDWOOD SYRAH 15	JOHNNY GREEN SEEDS	750 ML	11.25	126145	PINNACLE IMPORTS	CS	12
721512005061	y	PACIFIC RDWOOD CHARD 16	JGS-PACIFIC RDWOOD CHARD 16	JOHNNY GREEN SEEDS	750 ML	11.25	126141	PINNACLE IMPORTS	CS	12
721512010058	y	FREY BIODYNAMIC FIELD BLEND 2016	JGS-FREY BIODYNAMIC FIELD BLEND 2016	JOHNNY GREEN SEEDS	750 ML	13.5	126084	PINNACLE IMPORTS	CS	12
721512010065	y	FREY AGRICULTURIST RD N V	JGS-FREY AGRICULTURIST RD N V	JOHNNY GREEN SEEDS	750 ML	11.25	126081	PINNACLE IMPORTS	CS	12
721512010072	y	FREY AGRICULTURIST BLANC 2014	JGS-FREY AGRICULTURIST BLANC 2014	JOHNNY GREEN SEEDS	750 ML	11.25	126080	PINNACLE IMPORTS	CS	12
722588000158	y	SWANSON CYGNET NAPA MERLOT 2013	SWANSON CYGNET NAPA MERLOT 2013	VINTAGE WINE ESTATES	750 ML	28.5	103721	PINNACLE IMPORTS	CS	12
722588589028	y	VIEUX DONJON CDP 2015 375ML	VIEUX DONJON CDP 2015 375ML	WINES OF FRANCE	375 ML	23.96	1449	PINNACLE IMPORTS	CS	24
722588589028	y	SWANSON NAPA MERLOT 2013	SWANSON NAPA MERLOT 2013	VINTAGE WINE ESTATES	750 ML	24	11512012	PINNACLE IMPORTS	CS	12
722588602024	y	SWANSON PINOT GRIGIO 2016	SWANSON PINOT GRIGIO 2016	VINTAGE WINE ESTATES	750 ML	17.25	122740	PINNACLE IMPORTS	CS	12
722598249493	y	CRIOS CAB 2014	CRIOS CAB 2014	FOLIO WINE COMPANY LLC	750 ML	11.25	108880	PINNACLE IMPORTS	CS	12
